"id","paperId","questionNumber","questionText","questionType","marks","rawLlMExtractedQuestion"
"2177","218","177","What is the chemical symbol for tungsten?","MCQ","1","{""question_number"":""177"",""question_text"":""What is the chemical symbol for tungsten?"",""question_type"":""MCQ"",""marks"":1,""mcq_options"":[""A. Tu"",""B. W"",""C. Tg"",""D. Tn""]}"
"2178","218","178","What type of reaction breaks down esters into alcohols and acids?","MCQ","1","{""question_number"":""178"",""question_text"":""What type of reaction breaks down esters into alcohols and acids?"",""question_type"":""MCQ"",""marks"":1,""mcq_options"":[""A. Dehydration"",""B. Hydrolysis"",""C. Condensation"",""D. Elimination""]}"
"2179","218","179","What is the valency of sodium?","MCQ","1","{""question_number"":""179"",""question_text"":""What is the valency of sodium?"",""question_type"":""MCQ"",""marks"":1,""mcq_options"":[""A. 1"",""B. 2"",""C. 3"",""D. 4""]}"
"2180","218","180","Which reagent is used to test for proteins?","MCQ","1","{""question_number"":""180"",""question_text"":""Which reagent is used to test for proteins?"",""question_type"":""MCQ"",""marks"":1,""mcq_options"":[""A. Litmus"",""B. Biuret reagent"",""C. Iodine"",""D. Benedict's solution""]}"
"2181","219","181","Which isotope of carbon is used as a standard for atomic mass?","MCQ","1","{""question_number"":""181"",""question_text"":""Which isotope of carbon is used as a standard for atomic mass?"",""question_type"":""MCQ"",""marks"":1,""mcq_options"":[""A. Carbon-12"",""B. Carbon-13"",""C. Carbon-14"",""D. Carbon-11""]}"
"2182","219","182","Which alloy is used for making springs?","MCQ","1","{""question_number"":""182"",""question_text"":""Which alloy is used for making springs?"",""question_type"":""MCQ"",""marks"":1,""mcq_options"":[""A. Bronze"",""B. Spring steel"",""C. Brass"",""D. Pewter""]}"
"2183","219","183","What is the formula of magnesium hydroxide?","MCQ","1","{""question_number"":""183"",""question_text"":""What is the formula of magnesium hydroxide?"",""question_type"":""MCQ"",""marks"":1,""mcq_options"":[""A. MgOH"",""B. Mg(OH)2"",""C. Mg2OH"",""D. MgO2H2""]}"
"2184","219","184","Which method is used to extract chromium from its ore?","MCQ","1","{""question_number"":""184"",""question_text"":""Which method is used to extract chromium from its ore?"",""question_type"":""MCQ"",""marks"":1,""mcq_options"":[""A. Electrolysis"",""B. Reduction with aluminum"",""C. Roasting"",""D. Displacement""]}"
"2185","219","185","Which gas is used in the manufacture of ammonia?","MCQ","1","{""question_number"":""185"",""question_text"":""Which gas is used in the manufacture of ammonia?"",""question_type"":""MCQ"",""marks"":1,""mcq_options"":[""A. Methane"",""B. Ethylene"",""C. Acetylene"",""D. Hydrogen""]}"
"2186","219","186","Which salt is formed when lithium reacts with hydrochloric acid?","MCQ","1","{""question_number"":""186"",""question_text"":""Which salt is formed when lithium reacts with hydrochloric acid?"",""question_type"":""MCQ"",""marks"":1,""mcq_options"":[""A. Lithium sulfate"",""B. Lithium chloride"",""C. Lithium nitrate"",""D. Lithium carbonate""]}"
"2187","219","187","What is the formula of white vitriol?","MCQ","1","{""question_number"":""187"",""question_text"":""What is the formula of white vitriol?"",""question_type"":""MCQ"",""marks"":1,""mcq_options"":[""A. Zinc carbonate"",""B. Zinc sulfate"",""C. Zinc chloride"",""D. Zinc oxide""]}"
"2188","219","188","Which gas is produced when nitric acid reacts with copper?","MCQ","1","{""question_number"":""188"",""question_text"":""Which gas is produced when nitric acid reacts with copper?"",""question_type"":""MCQ"",""marks"":1,""mcq_options"":[""A. Hydrogen"",""B. Nitrogen dioxide"",""C. Nitric oxide"",""D. Ammonia""]}"
"2189","219","189","What is the formula for phenol?","MCQ","1","{""question_number"":""189"",""question_text"":""What is the formula for phenol?"",""question_type"":""MCQ"",""marks"":1,""mcq_options"":[""A. C6H5OH"",""B. C6H6O"",""C. C7H8O"",""D. C6H4OH""]}"
"2190","219","190","Which element is used in LEDs?","MCQ","1","{""question_number"":""190"",""question_text"":""Which element is used in LEDs?"",""question_type"":""MCQ"",""marks"":1,""mcq_options"":[""A. Silicon"",""B. Gallium"",""C. Germanium"",""D. Indium""]}"
"2191","220","191","What is the oxidation state of oxygen in carbon dioxide?","MCQ","1","{""question_number"":""191"",""question_text"":""What is the oxidation state of oxygen in carbon dioxide?"",""question_type"":""MCQ"",""marks"":1,""mcq_options"":[""A. -1"",""B. -2"",""C. -3"",""D. +2""]}"
"2192","220","192","Which metal is used in coins?","MCQ","1","{""question_number"":""192"",""question_text"":""Which metal is used in coins?"",""question_type"":""MCQ"",""marks"":1,""mcq_options"":[""A. Gold"",""B. Nickel"",""C. Silver"",""D. Platinum""]}"
"2193","220","193","What is the characteristic of nitric oxide?","MCQ","1","{""question_number"":""193"",""question_text"":""What is the characteristic of nitric oxide?"",""question_type"":""MCQ"",""marks"":1,""mcq_options"":[""A. Colorless gas that turns brown in air"",""B. Brown gas"",""C. Green gas"",""D. Blue gas""]}"
"2194","220","194","Which alkene is used to make polythene?","MCQ","1","{""question_number"":""194"",""question_text"":""Which alkene is used to make polythene?"",""question_type"":""MCQ"",""marks"":1,""mcq_options"":[""A. Ethylene"",""B. Propylene"",""C. Butylene"",""D. Acetylene""]}"
"2195","220","195","What is the formula of benzoic acid?","MCQ","1","{""question_number"":""195"",""question_text"":""What is the formula of benzoic acid?"",""question_type"":""MCQ"",""marks"":1,""mcq_options"":[""A. C7H6O2"",""B. C6H5COOH"",""C. C8H8O2"",""D. Both A and B""]}"
"2196","220","196","Which process is used to vulcanize rubber?","MCQ","1","{""question_number"":""196"",""question_text"":""Which process is used to vulcanize rubber?"",""question_type"":""MCQ"",""marks"":1,""mcq_options"":[""A. Adding sulfur"",""B. Adding oxygen"",""C. Adding nitrogen"",""D. Adding hydrogen""]}"
"2197","220","197","What is the chemical symbol for uranium?","MCQ","1","{""question_number"":""197"",""question_text"":""What is the chemical symbol for uranium?"",""question_type"":""MCQ"",""marks"":1,""mcq_options"":[""A. Ur"",""B. U"",""C. Un"",""D. Um""]}"
"2198","220","198","What type of reaction removes water from alcohols?","MCQ","1","{""question_number"":""198"",""question_text"":""What type of reaction removes water from alcohols?"",""question_type"":""MCQ"",""marks"":1,""mcq_options"":[""A. Hydrolysis"",""B. Dehydration"",""C. Hydration"",""D. Dissolution""]}"
"2199","220","199","What is the valency of potassium?","MCQ","1","{""question_number"":""199"",""question_text"":""What is the valency of potassium?"",""question_type"":""MCQ"",""marks"":1,""mcq_options"":[""A. 1"",""B. 2"",""C. 3"",""D. 4""]}"
"2200","220","200","Which reagent is used to test for fats?","MCQ","1","{""question_number"":""200"",""question_text"":""Which reagent is used to test for fats?"",""question_type"":""MCQ"",""marks"":1,""mcq_options"":[""A. Sudan III"",""B. Biuret reagent"",""C. Iodine"",""D. Benedict's solution""]}"
"2201","221","201","Explain the difference between covalent and ionic bonding.","FRQ","4","{""question_number"":""201"",""question_text"":""Explain the difference between covalent and ionic bonding."",""question_type"":""FRQ"",""marks"":4,""mcq_options"":null}"
"2202","221","202","Describe the process of fractional distillation of air.","FRQ","5","{""question_number"":""202"",""question_text"":""Describe the process of fractional distillation of air."",""question_type"":""FRQ"",""marks"":5,""mcq_options"":null}"
"2203","221","203","Explain the concept of pH and how it relates to acidity and alkalinity.","FRQ","3","{""question_number"":""203"",""question_text"":""Explain the concept of pH and how it relates to acidity and alkalinity."",""question_type"":""FRQ"",""marks"":3,""mcq_options"":null}"
"2204","221","204","Describe the structure and properties of metals.","FRQ","4","{""question_number"":""204"",""question_text"":""Describe the structure and properties of metals."",""question_type"":""FRQ"",""marks"":4,""mcq_options"":null}"
"2205","221","205","Explain the process of rusting and how it can be prevented.","FRQ","4","{""question_number"":""205"",""question_text"":""Explain the process of rusting and how it can be prevented."",""question_type"":""FRQ"",""marks"":4,""mcq_options"":null}"
"2206","221","206","Describe the properties and uses of transition metals.","FRQ","4","{""question_number"":""206"",""question_text"":""Describe the properties and uses of transition metals."",""question_type"":""FRQ"",""marks"":4,""mcq_options"":null}"
"2207","221","207","Explain the concept of allotropes with examples.","FRQ","3","{""question_number"":""207"",""question_text"":""Explain the concept of allotropes with examples."",""question_type"":""FRQ"",""marks"":3,""mcq_options"":null}"
"2208","221","208","Describe the process of making soap and explain how it works.","FRQ","4","{""question_number"":""208"",""question_text"":""Describe the process of making soap and explain how it works."",""question_type"":""FRQ"",""marks"":4,""mcq_options"":null}"
"2209","221","209","Explain the concept of isomerism in organic chemistry.","FRQ","3","{""question_number"":""209"",""question_text"":""Explain the concept of isomerism in organic chemistry."",""question_type"":""FRQ"",""marks"":3,""mcq_options"":null}"
"2210","221","210","Describe the properties and uses of noble gases.","FRQ","4","{""question_number"":""210"",""question_text"":""Describe the properties and uses of noble gases."",""question_type"":""FRQ"",""marks"":4,""mcq_options"":null}"
"2211","222","211","Explain the concept of electronegativity and how it affects bonding.","FRQ","3","{""question_number"":""211"",""question_text"":""Explain the concept of electronegativity and how it affects bonding."",""question_type"":""FRQ"",""marks"":3,""mcq_options"":null}"
"2212","222","212","Describe the process of making ammonia using the Haber process.","FRQ","5","{""question_number"":""212"",""question_text"":""Describe the process of making ammonia using the Haber process."",""question_type"":""FRQ"",""marks"":5,""mcq_options"":null}"
"2213","222","213","Explain the concept of dynamic equilibrium in reversible reactions.","FRQ","4","{""question_number"":""213"",""question_text"":""Explain the concept of dynamic equilibrium in reversible reactions."",""question_type"":""FRQ"",""marks"":4,""mcq_options"":null}"
"2214","222","214","Describe the structure and properties of ionic compounds.","FRQ","4","{""question_number"":""214"",""question_text"":""Describe the structure and properties of ionic compounds."",""question_type"":""FRQ"",""marks"":4,""mcq_options"":null}"
"2215","222","215","Explain the process of making sulfuric acid using the Contact process.","FRQ","5","{""question_number"":""215"",""question_text"":""Explain the process of making sulfuric acid using the Contact process."",""question_type"":""FRQ"",""marks"":5,""mcq_options"":null}"
"2216","222","216","Describe the properties and uses of halogens.","FRQ","4","{""question_number"":""216"",""question_text"":""Describe the properties and uses of halogens."",""question_type"":""FRQ"",""marks"":4,""mcq_options"":null}"
"2217","222","217","Explain the concept of polymerization with examples.","FRQ","4","{""question_number"":""217"",""question_text"":""Explain the concept of polymerization with examples."",""question_type"":""FRQ"",""marks"":4,""mcq_options"":null}"
"2218","222","218","Describe the process of making iron using a blast furnace.","FRQ","5","{""question_number"":""218"",""question_text"":""Describe the process of making iron using a blast furnace."",""question_type"":""FRQ"",""marks"":5,""mcq_options"":null}"
"2219","222","219","Explain the concept of homologous series in organic chemistry.","FRQ","3","{""question_number"":""219"",""question_text"":""Explain the concept of homologous series in organic chemistry."",""question_type"":""FRQ"",""marks"":3,""mcq_options"":null}"
"2220","222","220","Describe the properties and uses of alcohols.","FRQ","4","{""question_number"":""220"",""question_text"":""Describe the properties and uses of alcohols."",""question_type"":""FRQ"",""marks"":4,""mcq_options"":null}"
"2221","223","221","Explain the concept of relative atomic mass.","FRQ","3","{""question_number"":""221"",""question_text"":""Explain the concept of relative atomic mass."",""question_type"":""FRQ"",""marks"":3,""mcq_options"":null}"
"2222","223","222","Describe the process of making nitric acid using the Ostwald process.","FRQ","5","{""question_number"":""222"",""question_text"":""Describe the process of making nitric acid using the Ostwald process."",""question_type"":""FRQ"",""marks"":5,""mcq_options"":null}"
"2223","223","223","Explain the concept of catalysts and how they affect reaction rates.","FRQ","4","{""question_number"":""223"",""question_text"":""Explain the concept of catalysts and how they affect reaction rates."",""question_type"":""FRQ"",""marks"":4,""mcq_options"":null}"
"2224","223","224","Describe the structure and properties of covalent compounds.","FRQ","4","{""question_number"":""224"",""question_text"":""Describe the structure and properties of covalent compounds."",""question_type"":""FRQ"",""marks"":4,""mcq_options"":null}"
"2225","223","225","Explain the process of making chlorine using electrolysis.","FRQ","4","{""question_number"":""225"",""question_text"":""Explain the process of making chlorine using electrolysis."",""question_type"":""FRQ"",""marks"":4,""mcq_options"":null}"
"2226","223","226","Describe the properties and uses of carboxylic acids.","FRQ","4","{""question_number"":""226"",""question_text"":""Describe the properties and uses of carboxylic acids."",""question_type"":""FRQ"",""marks"":4,""mcq_options"":null}"
"2227","223","227","Explain the concept of functional groups in organic chemistry.","FRQ","3","{""question_number"":""227"",""question_text"":""Explain the concept of functional groups in organic chemistry."",""question_type"":""FRQ"",""marks"":3,""mcq_options"":null}"
"2228","223","228","Describe the process of making glass.","FRQ","4","{""question_number"":""228"",""question_text"":""Describe the process of making glass."",""question_type"":""FRQ"",""marks"":4,""mcq_options"":null}"
"2229","223","229","Explain the concept of acid rain and its effects.","FRQ","4","{""question_number"":""229"",""question_text"":""Explain the concept of acid rain and its effects."",""question_type"":""FRQ"",""marks"":4,""mcq_options"":null}"
"2230","223","230","Describe the properties and uses of esters.","FRQ","4","{""question_number"":""230"",""question_text"":""Describe the properties and uses of esters."",""question_type"":""FRQ"",""marks"":4,""mcq_options"":null}"
"2231","224","231","Explain the concept of empirical and molecular formulas.","FRQ","3","{""question_number"":""231"",""question_text"":""Explain the concept of empirical and molecular formulas."",""question_type"":""FRQ"",""marks"":3,""mcq_options"":null}"
"2232","224","232","Describe the process of making sodium hydroxide using the chlor-alkali process.","FRQ","5","{""question_number"":""232"",""question_text"":""Describe the process of making sodium hydroxide using the chlor-alkali process."",""question_type"":""FRQ"",""marks"":5,""mcq_options"":null}"
"2233","224","233","Explain the concept of collision theory in chemical reactions.","FRQ","4","{""question_number"":""233"",""question_text"":""Explain the concept of collision theory in chemical reactions."",""question_type"":""FRQ"",""marks"":4,""mcq_options"":null}"
"2234","224","234","Describe the structure and properties of giant covalent structures.","FRQ","4","{""question_number"":""234"",""question_text"":""Describe the structure and properties of giant covalent structures."",""question_type"":""FRQ"",""marks"":4,""mcq_options"":null}"
"2235","224","235","Explain the process of making fertilizers.","FRQ","4","{""question_number"":""235"",""question_text"":""Explain the process of making fertilizers."",""question_type"":""FRQ"",""marks"":4,""mcq_options"":null}"
"2236","224","236","Describe the properties and uses of alkenes.","FRQ","4","{""question_number"":""236"",""question_text"":""Describe the properties and uses of alkenes."",""question_type"":""FRQ"",""marks"":4,""mcq_options"":null}"
"2237","224","237","Explain the concept of esterification with examples.","FRQ","3","{""question_number"":""237"",""question_text"":""Explain the concept of esterification with examples."",""question_type"":""FRQ"",""marks"":3,""mcq_options"":null}"
"2238","224","238","Describe the process of making cement.","FRQ","4","{""question_number"":""238"",""question_text"":""Describe the process of making cement."",""question_type"":""FRQ"",""marks"":4,""mcq_options"":null}"
"2239","224","239","Explain the concept of greenhouse effect and global warming.","FRQ","4","{""question_number"":""239"",""question_text"":""Explain the concept of greenhouse effect and global warming."",""question_type"":""FRQ"",""marks"":4,""mcq_options"":null}"
"2240","224","240","Describe the properties and uses of amines.","FRQ","4","{""question_number"":""240"",""question_text"":""Describe the properties and uses of amines."",""question_type"":""FRQ"",""marks"":4,""mcq_options"":null}"
"2241","225","241","Explain the concept of mole and Avogadro's number.","FRQ","3","{""question_number"":""241"",""question_text"":""Explain the concept of mole and Avogadro's number."",""question_type"":""FRQ"",""marks"":3,""mcq_options"":null}"
"2242","225","242","Describe the process of making biodiesel.","FRQ","4","{""question_number"":""242"",""question_text"":""Describe the process of making biodiesel."",""question_type"":""FRQ"",""marks"":4,""mcq_options"":null}"
"2243","225","243","Explain the concept of Le Chatelier's principle with examples.","FRQ","4","{""question_number"":""243"",""question_text"":""Explain the concept of Le Chatelier's principle with examples."",""question_type"":""FRQ"",""marks"":4,""mcq_options"":null}"
"2244","225","244","Describe the structure and properties of simple molecular substances.","FRQ","4","{""question_number"":""244"",""question_text"":""Describe the structure and properties of simple molecular substances."",""question_type"":""FRQ"",""marks"":4,""mcq_options"":null}"
"2245","225","245","Explain the process of making hydrogen gas in the laboratory.","FRQ","3","{""question_number"":""245"",""question_text"":""Explain the process of making hydrogen gas in the laboratory."",""question_type"":""FRQ"",""marks"":3,""mcq_options"":null}"
"2246","225","246","Describe the properties and uses of alkanes.","FRQ","4","{""question_number"":""246"",""question_text"":""Describe the properties and uses of alkanes."",""question_type"":""FRQ"",""marks"":4,""mcq_options"":null}"
"2247","225","247","Explain the concept of cracking in the petroleum industry.","FRQ","3","{""question_number"":""247"",""question_text"":""Explain the concept of cracking in the petroleum industry."",""question_type"":""FRQ"",""marks"":3,""mcq_options"":null}"
"2248","225","248","Describe the process of making steel.","FRQ","4","{""question_number"":""248"",""question_text"":""Describe the process of making steel."",""question_type"":""FRQ"",""marks"":4,""mcq_options"":null}"
"2249","225","249","Explain the concept of water pollution and its effects.","FRQ","4","{""question_number"":""249"",""question_text"":""Explain the concept of water pollution and its effects."",""question_type"":""FRQ"",""marks"":4,""mcq_options"":null}"
"2250","225","250","Describe the properties and uses of aldehydes and ketones.","FRQ","4","{""question_number"":""250"",""question_text"":""Describe the properties and uses of aldehydes and ketones."",""question_type"":""FRQ"",""marks"":4,""mcq_options"":null}"
"2251","226","251","Explain the concept of stoichiometry in chemical reactions.","FRQ","4","{""question_number"":""251"",""question_text"":""Explain the concept of stoichiometry in chemical reactions."",""question_type"":""FRQ"",""marks"":4,""mcq_options"":null}"
"2252","226","252","Describe the process of making ethanol by fermentation.","FRQ","4","{""question_number"":""252"",""question_text"":""Describe the process of making ethanol by fermentation."",""question_type"":""FRQ"",""marks"":4,""mcq_options"":null}"
"2253","226","253","Explain the concept of rate of reaction and factors affecting it.","FRQ","4","{""question_number"":""253"",""question_text"":""Explain the concept of rate of reaction and factors affecting it."",""question_type"":""FRQ"",""marks"":4,""mcq_options"":null}"
"2254","226","254","Describe the structure and properties of metals and alloys.","FRQ","4","{""question_number"":""254"",""question_text"":""Describe the structure and properties of metals and alloys."",""question_type"":""FRQ"",""marks"":4,""mcq_options"":null}"
"2255","226","255","Explain the process of making oxygen gas in the laboratory.","FRQ","3","{""question_number"":""255"",""question_text"":""Explain the process of making oxygen gas in the laboratory."",""question_type"":""FRQ"",""marks"":3,""mcq_options"":null}"
"2256","226","256","Describe the properties and uses of alcohols.","FRQ","4","{""question_number"":""256"",""question_text"":""Describe the properties and uses of alcohols."",""question_type"":""FRQ"",""marks"":4,""mcq_options"":null}"
"2257","226","257","Explain the concept of addition polymerization with examples.","FRQ","3","{""question_number"":""257"",""question_text"":""Explain the concept of addition polymerization with examples."",""question_type"":""FRQ"",""marks"":3,""mcq_options"":null}"
"2258","226","258","Describe the process of making aluminum.","FRQ","4","{""question_number"":""258"",""question_text"":""Describe the process of making aluminum."",""question_type"":""FRQ"",""marks"":4,""mcq_options"":null}"
"2259","226","259","Explain the concept of air pollution and its effects.","FRQ","4","{""question_number"":""259"",""question_text"":""Explain the concept of air pollution and its effects."",""question_type"":""FRQ"",""marks"":4,""mcq_options"":null}"
"2260","226","260","Describe the properties and uses of carboxylic acids.","FRQ","4","{""question_number"":""260"",""question_text"":""Describe the properties and uses of carboxylic acids."",""question_type"":""FRQ"",""marks"":4,""mcq_options"":null}"
"2261","227","261","Explain the concept of percentage yield in chemical reactions.","FRQ","3","{""question_number"":""261"",""question_text"":""Explain the concept of percentage yield in chemical reactions."",""question_type"":""FRQ"",""marks"":3,""mcq_options"":null}"
"2262","227","262","Describe the process of making soap.","FRQ","4","{""question_number"":""262"",""question_text"":""Describe the process of making soap."",""question_type"":""FRQ"",""marks"":4,""mcq_options"":null}"
"2263","227","263","Explain the concept of energy changes in chemical reactions.","FRQ","4","{""question_number"":""263"",""question_text"":""Explain the concept of energy changes in chemical reactions."",""question_type"":""FRQ"",""marks"":4,""mcq_options"":null}"
"2264","227","264","Describe the structure and properties of ionic compounds.","FRQ","4","{""question_number"":""264"",""question_text"":""Describe the structure and properties of ionic compounds."",""question_type"":""FRQ"",""marks"":4,""mcq_options"":null}"
"2265","227","265","Explain the process of making carbon dioxide gas in the laboratory.","FRQ","3","{""question_number"":""265"",""question_text"":""Explain the process of making carbon dioxide gas in the laboratory."",""question_type"":""FRQ"",""marks"":3,""mcq_options"":null}"
"2266","227","266","Describe the properties and uses of ethers.","FRQ","4","{""question_number"":""266"",""question_text"":""Describe the properties and uses of ethers."",""question_type"":""FRQ"",""marks"":4,""mcq_options"":null}"
"2267","227","267","Explain the concept of condensation polymerization with examples.","FRQ","3","{""question_number"":""267"",""question_text"":""Explain the concept of condensation polymerization with examples."",""question_type"":""FRQ"",""marks"":3,""mcq_options"":null}"
"2268","227","268","Describe the process of making copper.","FRQ","4","{""question_number"":""268"",""question_text"":""Describe the process of making copper."",""question_type"":""FRQ"",""marks"":4,""mcq_options"":null}"
"2269","227","269","Explain the concept of ozone depletion and its effects.","FRQ","4","{""question_number"":""269"",""question_text"":""Explain the concept of ozone depletion and its effects."",""question_type"":""FRQ"",""marks"":4,""mcq_options"":null}"
"2270","227","270","Describe the properties and uses of amides.","FRQ","4","{""question_number"":""270"",""question_text"":""Describe the properties and uses of amides."",""question_type"":""FRQ"",""marks"":4,""mcq_options"":null}"
"2271","228","271","Explain the concept of limiting reactant in chemical reactions.","FRQ","3","{""question_number"":""271"",""question_text"":""Explain the concept of limiting reactant in chemical reactions."",""question_type"":""FRQ"",""marks"":3,""mcq_options"":null}"
"2272","228","272","Describe the process of making detergents.","FRQ","4","{""question_number"":""272"",""question_text"":""Describe the process of making detergents."",""question_type"":""FRQ"",""marks"":4,""mcq_options"":null}"
"2273","228","273","Explain the concept of bond energy and bond length.","FRQ","3","{""question_number"":""273"",""question_text"":""Explain the concept of bond energy and bond length."",""question_type"":""FRQ"",""marks"":3,""mcq_options"":null}"
