"id","paperId","questionNumber","questionText","questionType","marks","rawLlMExtractedQuestion"
"2090","209","90","Which element is essential for plant growth?","MCQ","1","{""question_number"":""90"",""question_text"":""Which element is essential for plant growth?"",""question_type"":""MCQ"",""marks"":1,""mcq_options"":[""A. Carbon"",""B. Nitrogen"",""C. Silicon"",""D. Sulfur""]}"
"2091","210","91","What is the oxidation state of nitrogen in ammonia?","MCQ","1","{""question_number"":""91"",""question_text"":""What is the oxidation state of nitrogen in ammonia?"",""question_type"":""MCQ"",""marks"":1,""mcq_options"":[""A. -1"",""B. -2"",""C. -3"",""D. +3""]}"
"2092","210","92","Which metal is used in electrical wiring?","MCQ","1","{""question_number"":""92"",""question_text"":""Which metal is used in electrical wiring?"",""question_type"":""MCQ"",""marks"":1,""mcq_options"":[""A. Iron"",""B. Copper"",""C. Aluminum"",""D. Lead""]}"
"2093","210","93","Which gas turns lime water milky?","MCQ","1","{""question_number"":""93"",""question_text"":""Which gas turns lime water milky?"",""question_type"":""MCQ"",""marks"":1,""mcq_options"":[""A. Burns with a pop"",""B. Relights a glowing splint"",""C. Turns lime water milky"",""D. Bleaches litmus paper""]}"
"2094","210","94","What is the main component of caustic soda?","MCQ","1","{""question_number"":""94"",""question_text"":""What is the main component of caustic soda?"",""question_type"":""MCQ"",""marks"":1,""mcq_options"":[""A. Sodium chloride"",""B. Sodium hydroxide"",""C. Sodium carbonate"",""D. Sodium sulfate""]}"
"2095","210","95","What is the formula of formic acid?","MCQ","1","{""question_number"":""95"",""question_text"":""What is the formula of formic acid?"",""question_type"":""MCQ"",""marks"":1,""mcq_options"":[""A. HCOOH"",""B. CH3COOH"",""C. C2H5COOH"",""D. CH3OH""]}"
"2096","210","96","Which processes are used in water treatment?","MCQ","1","{""question_number"":""96"",""question_text"":""Which processes are used in water treatment?"",""question_type"":""MCQ"",""marks"":1,""mcq_options"":[""A. Filtration"",""B. Distillation"",""C. Chlorination"",""D. All of the above""]}"
"2097","210","97","What is the chemical symbol for mercury?","MCQ","1","{""question_number"":""97"",""question_text"":""What is the chemical symbol for mercury?"",""question_type"":""MCQ"",""marks"":1,""mcq_options"":[""A. Me"",""B. Hg"",""C. Mr"",""D. Mc""]}"
"2098","210","98","What type of reaction breaks down a compound into simpler substances?","MCQ","1","{""question_number"":""98"",""question_text"":""What type of reaction breaks down a compound into simpler substances?"",""question_type"":""MCQ"",""marks"":1,""mcq_options"":[""A. Decomposition"",""B. Synthesis"",""C. Displacement"",""D. Neutralization""]}"
"2099","210","99","What is the valency of nitrogen in ammonia?","MCQ","1","{""question_number"":""99"",""question_text"":""What is the valency of nitrogen in ammonia?"",""question_type"":""MCQ"",""marks"":1,""mcq_options"":[""A. 1"",""B. 2"",""C. 3"",""D. 4""]}"
"2100","210","100","Which indicator turns blue in alkali?","MCQ","1","{""question_number"":""100"",""question_text"":""Which indicator turns blue in alkali?"",""question_type"":""MCQ"",""marks"":1,""mcq_options"":[""A. Litmus"",""B. Phenolphthalein"",""C. Methyl orange"",""D. Congo red""]}"
"2101","211","101","What is the number of electrons in the second shell?","MCQ","1","{""question_number"":""101"",""question_text"":""What is the number of electrons in the second shell?"",""question_type"":""MCQ"",""marks"":1,""mcq_options"":[""A. 6"",""B. 8"",""C. 14"",""D. 20""]}"
"2102","211","102","Which alloy is used for making aircraft parts?","MCQ","1","{""question_number"":""102"",""question_text"":""Which alloy is used for making aircraft parts?"",""question_type"":""MCQ"",""marks"":1,""mcq_options"":[""A. Bronze"",""B. Brass"",""C. Steel"",""D. Aluminum""]}"
"2103","211","103","What is the formula of calcium hydroxide?","MCQ","1","{""question_number"":""103"",""question_text"":""What is the formula of calcium hydroxide?"",""question_type"":""MCQ"",""marks"":1,""mcq_options"":[""A. CaOH"",""B. Ca(OH)2"",""C. Ca2OH"",""D. CaO2H2""]}"
"2104","211","104","Which method is used to extract copper from its ore?","MCQ","1","{""question_number"":""104"",""question_text"":""Which method is used to extract copper from its ore?"",""question_type"":""MCQ"",""marks"":1,""mcq_options"":[""A. Electrolysis"",""B. Reduction"",""C. Roasting and reduction"",""D. Heating""]}"
"2105","211","105","What is the product of incomplete combustion of hydrocarbons?","MCQ","1","{""question_number"":""105"",""question_text"":""What is the product of incomplete combustion of hydrocarbons?"",""question_type"":""MCQ"",""marks"":1,""mcq_options"":[""A. Carbon monoxide"",""B. Carbon dioxide"",""C. Hydrogen"",""D. Methane""]}"
"2106","211","106","Which salt is formed when iron reacts with hydrochloric acid?","MCQ","1","{""question_number"":""106"",""question_text"":""Which salt is formed when iron reacts with hydrochloric acid?"",""question_type"":""MCQ"",""marks"":1,""mcq_options"":[""A. Iron sulfate"",""B. Iron chloride"",""C. Iron nitrate"",""D. Iron carbonate""]}"
"2107","211","107","What is the formula of baking soda?","MCQ","1","{""question_number"":""107"",""question_text"":""What is the formula of baking soda?"",""question_type"":""MCQ"",""marks"":1,""mcq_options"":[""A. Sodium carbonate"",""B. Sodium bicarbonate"",""C. Sodium hydroxide"",""D. Sodium chloride""]}"
"2108","211","108","Which gas is used in welding?","MCQ","1","{""question_number"":""108"",""question_text"":""Which gas is used in welding?"",""question_type"":""MCQ"",""marks"":1,""mcq_options"":[""A. Hydrogen"",""B. Acetylene"",""C. Methane"",""D. Ethane""]}"
"2109","211","109","What is the formula for benzene?","MCQ","1","{""question_number"":""109"",""question_text"":""What is the formula for benzene?"",""question_type"":""MCQ"",""marks"":1,""mcq_options"":[""A. C6H6"",""B. C6H12"",""C. C6H14"",""D. C8H8""]}"
"2110","211","110","Which element is essential for fertilizers?","MCQ","1","{""question_number"":""110"",""question_text"":""Which element is essential for fertilizers?"",""question_type"":""MCQ"",""marks"":1,""mcq_options"":[""A. Carbon"",""B. Sulfur"",""C. Phosphorus"",""D. Silicon""]}"
"2111","212","111","What is the oxidation state of hydrogen in water?","MCQ","1","{""question_number"":""111"",""question_text"":""What is the oxidation state of hydrogen in water?"",""question_type"":""MCQ"",""marks"":1,""mcq_options"":[""A. -1"",""B. +1"",""C. -2"",""D. +2""]}"
"2112","212","112","Which metal is used in car batteries?","MCQ","1","{""question_number"":""112"",""question_text"":""Which metal is used in car batteries?"",""question_type"":""MCQ"",""marks"":1,""mcq_options"":[""A. Iron"",""B. Copper"",""C. Lead"",""D. Aluminum""]}"
"2113","212","113","Which gas turns red litmus blue?","MCQ","1","{""question_number"":""113"",""question_text"":""Which gas turns red litmus blue?"",""question_type"":""MCQ"",""marks"":1,""mcq_options"":[""A. Turns lime water milky"",""B. Turns red litmus blue"",""C. Burns with a pop"",""D. Bleaches litmus paper""]}"
"2114","212","114","Which salt is used as a fertilizer?","MCQ","1","{""question_number"":""114"",""question_text"":""Which salt is used as a fertilizer?"",""question_type"":""MCQ"",""marks"":1,""mcq_options"":[""A. Sodium chloride"",""B. Ammonium nitrate"",""C. Calcium carbonate"",""D. Potassium chloride""]}"
"2115","212","115","What is the formula of oxalic acid?","MCQ","1","{""question_number"":""115"",""question_text"":""What is the formula of oxalic acid?"",""question_type"":""MCQ"",""marks"":1,""mcq_options"":[""A. H2C2O4"",""B. HC2O4"",""C. C2H2O4"",""D. H2CO4""]}"
"2116","212","116","Which process is used to obtain salt from sea water?","MCQ","1","{""question_number"":""116"",""question_text"":""Which process is used to obtain salt from sea water?"",""question_type"":""MCQ"",""marks"":1,""mcq_options"":[""A. Filtration"",""B. Evaporation"",""C. Distillation"",""D. Crystallization""]}"
"2117","212","117","What is the chemical symbol for tin?","MCQ","1","{""question_number"":""117"",""question_text"":""What is the chemical symbol for tin?"",""question_type"":""MCQ"",""marks"":1,""mcq_options"":[""A. Ti"",""B. Sn"",""C. Tn"",""D. Si""]}"
"2118","212","118","What type of reaction occurs when two solutions form a precipitate?","MCQ","1","{""question_number"":""118"",""question_text"":""What type of reaction occurs when two solutions form a precipitate?"",""question_type"":""MCQ"",""marks"":1,""mcq_options"":[""A. Decomposition"",""B. Synthesis"",""C. Double displacement"",""D. Single displacement""]}"
"2119","212","119","What is the valency of carbon?","MCQ","1","{""question_number"":""119"",""question_text"":""What is the valency of carbon?"",""question_type"":""MCQ"",""marks"":1,""mcq_options"":[""A. 1"",""B. 2"",""C. 3"",""D. 4""]}"
"2120","212","120","Which indicator turns blue in alkali?","MCQ","1","{""question_number"":""120"",""question_text"":""Which indicator turns blue in alkali?"",""question_type"":""MCQ"",""marks"":1,""mcq_options"":[""A. Red litmus"",""B. Phenolphthalein"",""C. Methyl orange"",""D. Congo red""]}"
"2121","213","121","What is the isotope of hydrogen with mass number 2 called?","MCQ","1","{""question_number"":""121"",""question_text"":""What is the isotope of hydrogen with mass number 2 called?"",""question_type"":""MCQ"",""marks"":1,""mcq_options"":[""A. H-1"",""B. H-2"",""C. H-3"",""D. He-2""]}"
"2122","213","122","Which alloy is resistant to corrosion?","MCQ","1","{""question_number"":""122"",""question_text"":""Which alloy is resistant to corrosion?"",""question_type"":""MCQ"",""marks"":1,""mcq_options"":[""A. Bronze"",""B. Brass"",""C. Stainless steel"",""D. Pewter""]}"
"2123","213","123","What is the formula of potassium hydroxide?","MCQ","1","{""question_number"":""123"",""question_text"":""What is the formula of potassium hydroxide?"",""question_type"":""MCQ"",""marks"":1,""mcq_options"":[""A. KOH"",""B. K2OH"",""C. KO"",""D. K2O""]}"
"2124","213","124","Which method is used to extract iron from its ore?","MCQ","1","{""question_number"":""124"",""question_text"":""Which method is used to extract iron from its ore?"",""question_type"":""MCQ"",""marks"":1,""mcq_options"":[""A. Electrolysis"",""B. Reduction with carbon"",""C. Roasting"",""D. Displacement""]}"
"2125","213","125","What are the components of water gas?","MCQ","1","{""question_number"":""125"",""question_text"":""What are the components of water gas?"",""question_type"":""MCQ"",""marks"":1,""mcq_options"":[""A. Carbon monoxide and hydrogen"",""B. Carbon dioxide"",""C. Methane"",""D. Nitrogen""]}"
"2126","213","126","Which salt is formed when potassium reacts with sulfuric acid?","MCQ","1","{""question_number"":""126"",""question_text"":""Which salt is formed when potassium reacts with sulfuric acid?"",""question_type"":""MCQ"",""marks"":1,""mcq_options"":[""A. Potassium chloride"",""B. Potassium sulfate"",""C. Potassium nitrate"",""D. Potassium carbonate""]}"
"2127","213","127","What is the formula of Epsom salt?","MCQ","1","{""question_number"":""127"",""question_text"":""What is the formula of Epsom salt?"",""question_type"":""MCQ"",""marks"":1,""mcq_options"":[""A. Magnesium carbonate"",""B. Magnesium sulfate"",""C. Magnesium chloride"",""D. Magnesium oxide""]}"
"2128","213","128","Which gas is produced when sulfuric acid reacts with a metal?","MCQ","1","{""question_number"":""128"",""question_text"":""Which gas is produced when sulfuric acid reacts with a metal?"",""question_type"":""MCQ"",""marks"":1,""mcq_options"":[""A. Hydrogen"",""B. Oxygen"",""C. Sulfur dioxide"",""D. Hydrogen sulfide""]}"
"2129","213","129","What is the formula for toluene?","MCQ","1","{""question_number"":""129"",""question_text"":""What is the formula for toluene?"",""question_type"":""MCQ"",""marks"":1,""mcq_options"":[""A. C6H6"",""B. C7H8"",""C. C8H10"",""D. C6H12""]}"
"2130","213","130","Which element is used in semiconductors?","MCQ","1","{""question_number"":""130"",""question_text"":""Which element is used in semiconductors?"",""question_type"":""MCQ"",""marks"":1,""mcq_options"":[""A. Carbon"",""B. Silicon"",""C. Sulfur"",""D. Phosphorus""]}"
"2131","214","131","What is the oxidation state of fluorine in compounds?","MCQ","1","{""question_number"":""131"",""question_text"":""What is the oxidation state of fluorine in compounds?"",""question_type"":""MCQ"",""marks"":1,""mcq_options"":[""A. -1"",""B. +1"",""C. -2"",""D. +2""]}"
"2132","214","132","Which metal is liquid at room temperature?","MCQ","1","{""question_number"":""132"",""question_text"":""Which metal is liquid at room temperature?"",""question_type"":""MCQ"",""marks"":1,""mcq_options"":[""A. Gallium"",""B. Mercury"",""C. Cesium"",""D. All of the above""]}"
"2133","214","133","Which gas bleaches litmus paper?","MCQ","1","{""question_number"":""133"",""question_text"":""Which gas bleaches litmus paper?"",""question_type"":""MCQ"",""marks"":1,""mcq_options"":[""A. Turns lime water milky"",""B. Bleaches litmus paper"",""C. Turns potassium dichromate green"",""D. Burns with a blue flame""]}"
"2134","214","134","Which hydrocarbon is used to make polyethylene?","MCQ","1","{""question_number"":""134"",""question_text"":""Which hydrocarbon is used to make polyethylene?"",""question_type"":""MCQ"",""marks"":1,""mcq_options"":[""A. Ethylene"",""B. Methane"",""C. Propane"",""D. Butane""]}"
"2135","214","135","What is the formula of citric acid?","MCQ","1","{""question_number"":""135"",""question_text"":""What is the formula of citric acid?"",""question_type"":""MCQ"",""marks"":1,""mcq_options"":[""A. C6H8O7"",""B. C6H6O6"",""C. C4H6O5"",""D. C3H4O3""]}"
"2136","214","136","Which process converts unsaturated fats to saturated fats?","MCQ","1","{""question_number"":""136"",""question_text"":""Which process converts unsaturated fats to saturated fats?"",""question_type"":""MCQ"",""marks"":1,""mcq_options"":[""A. Oxidation"",""B. Hydrogenation"",""C. Polymerization"",""D. Esterification""]}"
"2137","214","137","What is the chemical symbol for lead?","MCQ","1","{""question_number"":""137"",""question_text"":""What is the chemical symbol for lead?"",""question_type"":""MCQ"",""marks"":1,""mcq_options"":[""A. L"",""B. Pb"",""C. Ld"",""D. Le""]}"
"2138","214","138","What type of reaction occurs when zinc displaces copper from copper sulfate solution?","MCQ","1","{""question_number"":""138"",""question_text"":""What type of reaction occurs when zinc displaces copper from copper sulfate solution?"",""question_type"":""MCQ"",""marks"":1,""mcq_options"":[""A. Decomposition"",""B. Synthesis"",""C. Single displacement"",""D. Double displacement""]}"
"2139","214","139","What is the valency of magnesium?","MCQ","1","{""question_number"":""139"",""question_text"":""What is the valency of magnesium?"",""question_type"":""MCQ"",""marks"":1,""mcq_options"":[""A. 1"",""B. 2"",""C. 3"",""D. 4""]}"
"2140","214","140","Which reagent is used to test for starch?","MCQ","1","{""question_number"":""140"",""question_text"":""Which reagent is used to test for starch?"",""question_type"":""MCQ"",""marks"":1,""mcq_options"":[""A. Litmus"",""B. Phenolphthalein"",""C. Iodine"",""D. Methyl orange""]}"
"2141","215","141","What is the half-life of carbon-14?","MCQ","1","{""question_number"":""141"",""question_text"":""What is the half-life of carbon-14?"",""question_type"":""MCQ"",""marks"":1,""mcq_options"":[""A. 5730 years"",""B. 1000 years"",""C. 10000 years"",""D. 100 years""]}"
"2142","215","142","Which alloy contains gold and silver?","MCQ","1","{""question_number"":""142"",""question_text"":""Which alloy contains gold and silver?"",""question_type"":""MCQ"",""marks"":1,""mcq_options"":[""A. Bronze"",""B. White gold"",""C. Steel"",""D. Pewter""]}"
"2143","215","143","What is the formula of aluminum hydroxide?","MCQ","1","{""question_number"":""143"",""question_text"":""What is the formula of aluminum hydroxide?"",""question_type"":""MCQ"",""marks"":1,""mcq_options"":[""A. AlOH"",""B. Al(OH)3"",""C. Al2OH"",""D. Al3OH""]}"
"2144","215","144","Which method is used to purify copper?","MCQ","1","{""question_number"":""144"",""question_text"":""Which method is used to purify copper?"",""question_type"":""MCQ"",""marks"":1,""mcq_options"":[""A. Electrolysis"",""B. Precipitation"",""C. Distillation"",""D. Filtration""]}"
"2145","215","145","What are the components of producer gas?","MCQ","1","{""question_number"":""145"",""question_text"":""What are the components of producer gas?"",""question_type"":""MCQ"",""marks"":1,""mcq_options"":[""A. Carbon monoxide and hydrogen"",""B. Carbon dioxide"",""C. Methane"",""D. Nitrogen""]}"
"2146","215","146","Which salt is formed when sodium reacts with nitric acid?","MCQ","1","{""question_number"":""146"",""question_text"":""Which salt is formed when sodium reacts with nitric acid?"",""question_type"":""MCQ"",""marks"":1,""mcq_options"":[""A. Sodium chloride"",""B. Sodium sulfate"",""C. Sodium nitrate"",""D. Sodium carbonate""]}"
"2147","215","147","What is the formula of blue vitriol?","MCQ","1","{""question_number"":""147"",""question_text"":""What is the formula of blue vitriol?"",""question_type"":""MCQ"",""marks"":1,""mcq_options"":[""A. Copper carbonate"",""B. Copper sulfate"",""C. Copper chloride"",""D. Copper oxide""]}"
"2148","215","148","Which gas is produced when a base reacts with an ammonium salt?","MCQ","1","{""question_number"":""148"",""question_text"":""Which gas is produced when a base reacts with an ammonium salt?"",""question_type"":""MCQ"",""marks"":1,""mcq_options"":[""A. Hydrogen"",""B. Oxygen"",""C. Nitrogen"",""D. No gas is produced""]}"
"2149","215","149","What is the formula for naphthalene?","MCQ","1","{""question_number"":""149"",""question_text"":""What is the formula for naphthalene?"",""question_type"":""MCQ"",""marks"":1,""mcq_options"":[""A. C8H8"",""B. C10H8"",""C. C6H6"",""D. C12H10""]}"
"2150","215","150","Which elements are metalloids?","MCQ","1","{""question_number"":""150"",""question_text"":""Which elements are metalloids?"",""question_type"":""MCQ"",""marks"":1,""mcq_options"":[""A. Carbon"",""B. Silicon"",""C. Germanium"",""D. Both B and C""]}"
"2151","216","151","What is the oxidation state of sulfur in sulfate ion?","MCQ","1","{""question_number"":""151"",""question_text"":""What is the oxidation state of sulfur in sulfate ion?"",""question_type"":""MCQ"",""marks"":1,""mcq_options"":[""A. -1"",""B. -2"",""C. -3"",""D. +2""]}"
"2152","216","152","Which metal is used in thermometers?","MCQ","1","{""question_number"":""152"",""question_text"":""Which metal is used in thermometers?"",""question_type"":""MCQ"",""marks"":1,""mcq_options"":[""A. Silver"",""B. Mercury"",""C. Copper"",""D. Aluminum""]}"
"2153","216","153","What color is nitrogen dioxide gas?","MCQ","1","{""question_number"":""153"",""question_text"":""What color is nitrogen dioxide gas?"",""question_type"":""MCQ"",""marks"":1,""mcq_options"":[""A. Brown gas"",""B. Colorless gas"",""C. Green gas"",""D. Blue gas""]}"
"2154","216","154","Which hydrocarbon is used to make rubber?","MCQ","1","{""question_number"":""154"",""question_text"":""Which hydrocarbon is used to make rubber?"",""question_type"":""MCQ"",""marks"":1,""mcq_options"":[""A. Isoprene"",""B. Ethylene"",""C. Propylene"",""D. Butylene""]}"
"2155","216","155","What is the formula of lactic acid?","MCQ","1","{""question_number"":""155"",""question_text"":""What is the formula of lactic acid?"",""question_type"":""MCQ"",""marks"":1,""mcq_options"":[""A. C3H6O3"",""B. C2H4O2"",""C. C4H8O4"",""D. C6H12O6""]}"
"2156","216","156","Which process is used to harden vegetable oils?","MCQ","1","{""question_number"":""156"",""question_text"":""Which process is used to harden vegetable oils?"",""question_type"":""MCQ"",""marks"":1,""mcq_options"":[""A. Oxidation"",""B. Hydrogenation"",""C. Polymerization"",""D. Fermentation""]}"
"2157","216","157","What is the chemical symbol for platinum?","MCQ","1","{""question_number"":""157"",""question_text"":""What is the chemical symbol for platinum?"",""question_type"":""MCQ"",""marks"":1,""mcq_options"":[""A. Pl"",""B. Pt"",""C. Pa"",""D. Po""]}"
"2158","216","158","What type of reaction occurs when silver nitrate reacts with sodium chloride?","MCQ","1","{""question_number"":""158"",""question_text"":""What type of reaction occurs when silver nitrate reacts with sodium chloride?"",""question_type"":""MCQ"",""marks"":1,""mcq_options"":[""A. Decomposition"",""B. Synthesis"",""C. Precipitation"",""D. Combustion""]}"
"2159","216","159","What is the valency of lithium?","MCQ","1","{""question_number"":""159"",""question_text"":""What is the valency of lithium?"",""question_type"":""MCQ"",""marks"":1,""mcq_options"":[""A. 1"",""B. 2"",""C. 3"",""D. 4""]}"
"2160","216","160","Which reagent is used to test for reducing sugars?","MCQ","1","{""question_number"":""160"",""question_text"":""Which reagent is used to test for reducing sugars?"",""question_type"":""MCQ"",""marks"":1,""mcq_options"":[""A. Litmus"",""B. Benedict's solution"",""C. Iodine"",""D. Phenolphthalein""]}"
"2161","217","161","How many protons are in the nucleus of uranium-238?","MCQ","1","{""question_number"":""161"",""question_text"":""How many protons are in the nucleus of uranium-238?"",""question_type"":""MCQ"",""marks"":1,""mcq_options"":[""A. 90"",""B. 92"",""C. 94"",""D. 96""]}"
"2162","217","162","Which alloy contains mercury?","MCQ","1","{""question_number"":""162"",""question_text"":""Which alloy contains mercury?"",""question_type"":""MCQ"",""marks"":1,""mcq_options"":[""A. Amalgam"",""B. Bronze"",""C. Brass"",""D. Steel""]}"
"2163","217","163","What is the formula of barium hydroxide?","MCQ","1","{""question_number"":""163"",""question_text"":""What is the formula of barium hydroxide?"",""question_type"":""MCQ"",""marks"":1,""mcq_options"":[""A. BaOH"",""B. Ba(OH)2"",""C. Ba2OH"",""D. BaO2H2""]}"
"2164","217","164","Which process is used to extract titanium?","MCQ","1","{""question_number"":""164"",""question_text"":""Which process is used to extract titanium?"",""question_type"":""MCQ"",""marks"":1,""mcq_options"":[""A. Electrolysis"",""B. Kroll process"",""C. Blast furnace"",""D. Roasting""]}"
"2165","217","165","Which gases are present in natural gas?","MCQ","1","{""question_number"":""165"",""question_text"":""Which gases are present in natural gas?"",""question_type"":""MCQ"",""marks"":1,""mcq_options"":[""A. Hydrogen"",""B. Carbon monoxide"",""C. Methane"",""D. All of the above""]}"
"2166","217","166","Which salt is used in X-ray imaging?","MCQ","1","{""question_number"":""166"",""question_text"":""Which salt is used in X-ray imaging?"",""question_type"":""MCQ"",""marks"":1,""mcq_options"":[""A. Barium chloride"",""B. Barium sulfate"",""C. Barium nitrate"",""D. Barium carbonate""]}"
"2167","217","167","What is the formula of green vitriol?","MCQ","1","{""question_number"":""167"",""question_text"":""What is the formula of green vitriol?"",""question_type"":""MCQ"",""marks"":1,""mcq_options"":[""A. Iron carbonate"",""B. Iron sulfate"",""C. Iron chloride"",""D. Iron oxide""]}"
"2168","217","168","Which gas is produced when a metal carbonate reacts with an acid?","MCQ","1","{""question_number"":""168"",""question_text"":""Which gas is produced when a metal carbonate reacts with an acid?"",""question_type"":""MCQ"",""marks"":1,""mcq_options"":[""A. Hydrogen"",""B. Oxygen"",""C. Nitrogen"",""D. Ammonia""]}"
"2169","217","169","What is the formula for anthracene?","MCQ","1","{""question_number"":""169"",""question_text"":""What is the formula for anthracene?"",""question_type"":""MCQ"",""marks"":1,""mcq_options"":[""A. C12H10"",""B. C14H10"",""C. C16H12"",""D. C18H14""]}"
"2170","217","170","Which element is used in solar cells?","MCQ","1","{""question_number"":""170"",""question_text"":""Which element is used in solar cells?"",""question_type"":""MCQ"",""marks"":1,""mcq_options"":[""A. Carbon"",""B. Silicon"",""C. Germanium"",""D. Gallium""]}"
"2171","218","171","What is the oxidation state of chlorine in hydrochloric acid?","MCQ","1","{""question_number"":""171"",""question_text"":""What is the oxidation state of chlorine in hydrochloric acid?"",""question_type"":""MCQ"",""marks"":1,""mcq_options"":[""A. -1"",""B. -2"",""C. -3"",""D. +1""]}"
"2172","218","172","Which metal is used as a catalyst in the Haber process?","MCQ","1","{""question_number"":""172"",""question_text"":""Which metal is used as a catalyst in the Haber process?"",""question_type"":""MCQ"",""marks"":1,""mcq_options"":[""A. Iron"",""B. Platinum"",""C. Copper"",""D. Aluminum""]}"
"2173","218","173","What is the characteristic smell of hydrogen sulfide?","MCQ","1","{""question_number"":""173"",""question_text"":""What is the characteristic smell of hydrogen sulfide?"",""question_type"":""MCQ"",""marks"":1,""mcq_options"":[""A. Rotten egg smell"",""B. Sweet smell"",""C. No smell"",""D. Pungent smell""]}"
"2174","218","174","Which acid is used to make nylon?","MCQ","1","{""question_number"":""174"",""question_text"":""Which acid is used to make nylon?"",""question_type"":""MCQ"",""marks"":1,""mcq_options"":[""A. Adipic acid"",""B. Acetic acid"",""C. Formic acid"",""D. Oxalic acid""]}"
"2175","218","175","What is the formula of tartaric acid?","MCQ","1","{""question_number"":""175"",""question_text"":""What is the formula of tartaric acid?"",""question_type"":""MCQ"",""marks"":1,""mcq_options"":[""A. C4H6O6"",""B. C3H4O3"",""C. C6H8O7"",""D. C2H2O4""]}"
"2176","218","176","Which process is used to make soap?","MCQ","1","{""question_number"":""176"",""question_text"":""Which process is used to make soap?"",""question_type"":""MCQ"",""marks"":1,""mcq_options"":[""A. Esterification"",""B. Saponification"",""C. Hydrogenation"",""D. Polymerization""]}"
