"id","paperId","questionNumber","questionText","questionType","marks","rawLlMExtractedQuestion"
"2274","228","274","Describe the structure and properties of covalent compounds.","FRQ","4","{""question_number"":""274"",""question_text"":""Describe the structure and properties of covalent compounds."",""question_type"":""FRQ"",""marks"":4,""mcq_options"":null}"
"2275","228","275","Explain the process of making ammonia gas in the laboratory.","FRQ","3","{""question_number"":""275"",""question_text"":""Explain the process of making ammonia gas in the laboratory."",""question_type"":""FRQ"",""marks"":3,""mcq_options"":null}"
"2276","228","276","Describe the properties and uses of phenols.","FRQ","4","{""question_number"":""276"",""question_text"":""Describe the properties and uses of phenols."",""question_type"":""FRQ"",""marks"":4,""mcq_options"":null}"
"2277","228","277","Explain the concept of isomerism in alkanes.","FRQ","3","{""question_number"":""277"",""question_text"":""Explain the concept of isomerism in alkanes."",""question_type"":""FRQ"",""marks"":3,""mcq_options"":null}"
"2278","228","278","Describe the process of making zinc.","FRQ","4","{""question_number"":""278"",""question_text"":""Describe the process of making zinc."",""question_type"":""FRQ"",""marks"":4,""mcq_options"":null}"
"2279","228","279","Explain the concept of water treatment and purification.","FRQ","4","{""question_number"":""279"",""question_text"":""Explain the concept of water treatment and purification."",""question_type"":""FRQ"",""marks"":4,""mcq_options"":null}"
"2280","228","280","Describe the properties and uses of nitriles.","FRQ","4","{""question_number"":""280"",""question_text"":""Describe the properties and uses of nitriles."",""question_type"":""FRQ"",""marks"":4,""mcq_options"":null}"
"2281","229","281","Explain the concept of molarity and how to calculate it.","FRQ","3","{""question_number"":""281"",""question_text"":""Explain the concept of molarity and how to calculate it."",""question_type"":""FRQ"",""marks"":3,""mcq_options"":null}"
"2282","229","282","Describe the process of making margarine.","FRQ","4","{""question_number"":""282"",""question_text"":""Describe the process of making margarine."",""question_type"":""FRQ"",""marks"":4,""mcq_options"":null}"
"2283","229","283","Explain the concept of electrochemical cells and batteries.","FRQ","4","{""question_number"":""283"",""question_text"":""Explain the concept of electrochemical cells and batteries."",""question_type"":""FRQ"",""marks"":4,""mcq_options"":null}"
"2284","229","284","Describe the structure and properties of metals.","FRQ","4","{""question_number"":""284"",""question_text"":""Describe the structure and properties of metals."",""question_type"":""FRQ"",""marks"":4,""mcq_options"":null}"
"2285","229","285","Explain the process of making chlorine gas in the laboratory.","FRQ","3","{""question_number"":""285"",""question_text"":""Explain the process of making chlorine gas in the laboratory."",""question_type"":""FRQ"",""marks"":3,""mcq_options"":null}"
"2286","229","286","Describe the properties and uses of ethers.","FRQ","4","{""question_number"":""286"",""question_text"":""Describe the properties and uses of ethers."",""question_type"":""FRQ"",""marks"":4,""mcq_options"":null}"
"2287","229","287","Explain the concept of structural isomerism with examples.","FRQ","3","{""question_number"":""287"",""question_text"":""Explain the concept of structural isomerism with examples."",""question_type"":""FRQ"",""marks"":3,""mcq_options"":null}"
"2288","229","288","Describe the process of making lead.","FRQ","4","{""question_number"":""288"",""question_text"":""Describe the process of making lead."",""question_type"":""FRQ"",""marks"":4,""mcq_options"":null}"
"2289","229","289","Explain the concept of sewage treatment and disposal.","FRQ","4","{""question_number"":""289"",""question_text"":""Explain the concept of sewage treatment and disposal."",""question_type"":""FRQ"",""marks"":4,""mcq_options"":null}"
"2290","229","290","Describe the properties and uses of amines.","FRQ","4","{""question_number"":""290"",""question_text"":""Describe the properties and uses of amines."",""question_type"":""FRQ"",""marks"":4,""mcq_options"":null}"
"2291","230","291","Explain the concept of percentage composition and how to calculate it.","FRQ","3","{""question_number"":""291"",""question_text"":""Explain the concept of percentage composition and how to calculate it."",""question_type"":""FRQ"",""marks"":3,""mcq_options"":null}"
"2292","230","292","Describe the process of making biodiesel.","FRQ","4","{""question_number"":""292"",""question_text"":""Describe the process of making biodiesel."",""question_type"":""FRQ"",""marks"":4,""mcq_options"":null}"
"2293","230","293","Explain the concept of redox reactions with examples.","FRQ","4","{""question_number"":""293"",""question_text"":""Explain the concept of redox reactions with examples."",""question_type"":""FRQ"",""marks"":4,""mcq_options"":null}"
"2294","230","294","Describe the structure and properties of non-metals.","FRQ","4","{""question_number"":""294"",""question_text"":""Describe the structure and properties of non-metals."",""question_type"":""FRQ"",""marks"":4,""mcq_options"":null}"
"2295","230","295","Explain the process of making hydrogen gas in the laboratory.","FRQ","3","{""question_number"":""295"",""question_text"":""Explain the process of making hydrogen gas in the laboratory."",""question_type"":""FRQ"",""marks"":3,""mcq_options"":null}"
"2296","230","296","Describe the properties and uses of esters.","FRQ","4","{""question_number"":""296"",""question_text"":""Describe the properties and uses of esters."",""question_type"":""FRQ"",""marks"":4,""mcq_options"":null}"
"2297","230","297","Explain the concept of geometric isomerism with examples.","FRQ","3","{""question_number"":""297"",""question_text"":""Explain the concept of geometric isomerism with examples."",""question_type"":""FRQ"",""marks"":3,""mcq_options"":null}"
"2298","230","298","Describe the process of making tin.","FRQ","4","{""question_number"":""298"",""question_text"":""Describe the process of making tin."",""question_type"":""FRQ"",""marks"":4,""mcq_options"":null}"
"2299","230","299","Explain the concept of water pollution and its effects.","FRQ","4","{""question_number"":""299"",""question_text"":""Explain the concept of water pollution and its effects."",""question_type"":""FRQ"",""marks"":4,""mcq_options"":null}"
"2300","230","300","Describe the properties and uses of amides.","FRQ","4","{""question_number"":""300"",""question_text"":""Describe the properties and uses of amides."",""question_type"":""FRQ"",""marks"":4,""mcq_options"":null}"
"2301","231","301","Explain the concept of empirical formula and how to determine it.","FRQ","3","{""question_number"":""301"",""question_text"":""Explain the concept of empirical formula and how to determine it."",""question_type"":""FRQ"",""marks"":3,""mcq_options"":null}"
"2302","231","302","Describe the process of making nylon.","FRQ","4","{""question_number"":""302"",""question_text"":""Describe the process of making nylon."",""question_type"":""FRQ"",""marks"":4,""mcq_options"":null}"
"2303","231","303","Explain the concept of electrolysis with examples.","FRQ","4","{""question_number"":""303"",""question_text"":""Explain the concept of electrolysis with examples."",""question_type"":""FRQ"",""marks"":4,""mcq_options"":null}"
"2304","231","304","Describe the structure and properties of alloys.","FRQ","4","{""question_number"":""304"",""question_text"":""Describe the structure and properties of alloys."",""question_type"":""FRQ"",""marks"":4,""mcq_options"":null}"
"2305","231","305","Explain the process of making nitrogen gas in the laboratory.","FRQ","3","{""question_number"":""305"",""question_text"":""Explain the process of making nitrogen gas in the laboratory."",""question_type"":""FRQ"",""marks"":3,""mcq_options"":null}"
"2306","231","306","Describe the properties and uses of aldehydes.","FRQ","4","{""question_number"":""306"",""question_text"":""Describe the properties and uses of aldehydes."",""question_type"":""FRQ"",""marks"":4,""mcq_options"":null}"
"2307","231","307","Explain the concept of optical isomerism with examples.","FRQ","3","{""question_number"":""307"",""question_text"":""Explain the concept of optical isomerism with examples."",""question_type"":""FRQ"",""marks"":3,""mcq_options"":null}"
"2308","231","308","Describe the process of making nickel.","FRQ","4","{""question_number"":""308"",""question_text"":""Describe the process of making nickel."",""question_type"":""FRQ"",""marks"":4,""mcq_options"":null}"
"2309","231","309","Explain the concept of air pollution and its effects.","FRQ","4","{""question_number"":""309"",""question_text"":""Explain the concept of air pollution and its effects."",""question_type"":""FRQ"",""marks"":4,""mcq_options"":null}"
"2310","231","310","Describe the properties and uses of ketones.","FRQ","4","{""question_number"":""310"",""question_text"":""Describe the properties and uses of ketones."",""question_type"":""FRQ"",""marks"":4,""mcq_options"":null}"
"2311","232","311","Explain the concept of molecular formula and how to determine it.","FRQ","3","{""question_number"":""311"",""question_text"":""Explain the concept of molecular formula and how to determine it."",""question_type"":""FRQ"",""marks"":3,""mcq_options"":null}"
"2312","232","312","Describe the process of making polyester.","FRQ","4","{""question_number"":""312"",""question_text"":""Describe the process of making polyester."",""question_type"":""FRQ"",""marks"":4,""mcq_options"":null}"
"2313","232","313","Explain the concept of electrochemical series with examples.","FRQ","4","{""question_number"":""313"",""question_text"":""Explain the concept of electrochemical series with examples."",""question_type"":""FRQ"",""marks"":4,""mcq_options"":null}"
"2314","232","314","Describe the structure and properties of polymers.","FRQ","4","{""question_number"":""314"",""question_text"":""Describe the structure and properties of polymers."",""question_type"":""FRQ"",""marks"":4,""mcq_options"":null}"
"2315","232","315","Explain the process of making sulfur dioxide gas in the laboratory.","FRQ","3","{""question_number"":""315"",""question_text"":""Explain the process of making sulfur dioxide gas in the laboratory."",""question_type"":""FRQ"",""marks"":3,""mcq_options"":null}"
"2316","232","316","Describe the properties and uses of ketones.","FRQ","4","{""question_number"":""316"",""question_text"":""Describe the properties and uses of ketones."",""question_type"":""FRQ"",""marks"":4,""mcq_options"":null}"
"2317","232","317","Explain the concept of stereoisomerism with examples.","FRQ","3","{""question_number"":""317"",""question_text"":""Explain the concept of stereoisomerism with examples."",""question_type"":""FRQ"",""marks"":3,""mcq_options"":null}"
"2318","232","318","Describe the process of making silver.","FRQ","4","{""question_number"":""318"",""question_text"":""Describe the process of making silver."",""question_type"":""FRQ"",""marks"":4,""mcq_options"":null}"
"2319","232","319","Explain the concept of soil pollution and its effects.","FRQ","4","{""question_number"":""319"",""question_text"":""Explain the concept of soil pollution and its effects."",""question_type"":""FRQ"",""marks"":4,""mcq_options"":null}"
"2320","232","320","Describe the properties and uses of ethers.","FRQ","4","{""question_number"":""320"",""question_text"":""Describe the properties and uses of ethers."",""question_type"":""FRQ"",""marks"":4,""mcq_options"":null}"
"2321","233","321","Explain the concept of relative molecular mass and how to calculate it.","FRQ","3","{""question_number"":""321"",""question_text"":""Explain the concept of relative molecular mass and how to calculate it."",""question_type"":""FRQ"",""marks"":3,""mcq_options"":null}"
"2322","233","322","Describe the process of making PVC.","FRQ","4","{""question_number"":""322"",""question_text"":""Describe the process of making PVC."",""question_type"":""FRQ"",""marks"":4,""mcq_options"":null}"
"2323","233","323","Explain the concept of half-cell potentials with examples.","FRQ","4","{""question_number"":""323"",""question_text"":""Explain the concept of half-cell potentials with examples."",""question_type"":""FRQ"",""marks"":4,""mcq_options"":null}"
"2324","233","324","Describe the structure and properties of thermosetting plastics.","FRQ","4","{""question_number"":""324"",""question_text"":""Describe the structure and properties of thermosetting plastics."",""question_type"":""FRQ"",""marks"":4,""mcq_options"":null}"
"2325","233","325","Explain the process of making hydrogen chloride gas in the laboratory.","FRQ","3","{""question_number"":""325"",""question_text"":""Explain the process of making hydrogen chloride gas in the laboratory."",""question_type"":""FRQ"",""marks"":3,""mcq_options"":null}"
"2326","233","326","Describe the properties and uses of phenols.","FRQ","4","{""question_number"":""326"",""question_text"":""Describe the properties and uses of phenols."",""question_type"":""FRQ"",""marks"":4,""mcq_options"":null}"
"2327","233","327","Explain the concept of E/Z isomerism with examples.","FRQ","3","{""question_number"":""327"",""question_text"":""Explain the concept of E/Z isomerism with examples."",""question_type"":""FRQ"",""marks"":3,""mcq_options"":null}"
"2328","233","328","Describe the process of making gold.","FRQ","4","{""question_number"":""328"",""question_text"":""Describe the process of making gold."",""question_type"":""FRQ"",""marks"":4,""mcq_options"":null}"
"2329","233","329","Explain the concept of noise pollution and its effects.","FRQ","4","{""question_number"":""329"",""question_text"":""Explain the concept of noise pollution and its effects."",""question_type"":""FRQ"",""marks"":4,""mcq_options"":null}"
"2330","233","330","Describe the properties and uses of nitriles.","FRQ","4","{""question_number"":""330"",""question_text"":""Describe the properties and uses of nitriles."",""question_type"":""FRQ"",""marks"":4,""mcq_options"":null}"
"2331","234","331","Explain the concept of percentage purity and how to calculate it.","FRQ","3","{""question_number"":""331"",""question_text"":""Explain the concept of percentage purity and how to calculate it."",""question_type"":""FRQ"",""marks"":3,""mcq_options"":null}"
"2332","234","332","Describe the process of making polythene.","FRQ","4","{""question_number"":""332"",""question_text"":""Describe the process of making polythene."",""question_type"":""FRQ"",""marks"":4,""mcq_options"":null}"
"2333","234","333","Explain the concept of fuel cells with examples.","FRQ","4","{""question_number"":""333"",""question_text"":""Explain the concept of fuel cells with examples."",""question_type"":""FRQ"",""marks"":4,""mcq_options"":null}"
"2334","234","334","Describe the structure and properties of thermoplastics.","FRQ","4","{""question_number"":""334"",""question_text"":""Describe the structure and properties of thermoplastics."",""question_type"":""FRQ"",""marks"":4,""mcq_options"":null}"
"2335","234","335","Explain the process of making ammonia gas in the laboratory.","FRQ","3","{""question_number"":""335"",""question_text"":""Explain the process of making ammonia gas in the laboratory."",""question_type"":""FRQ"",""marks"":3,""mcq_options"":null}"
"2336","234","336","Describe the properties and uses of halogenoalkanes.","FRQ","4","{""question_number"":""336"",""question_text"":""Describe the properties and uses of halogenoalkanes."",""question_type"":""FRQ"",""marks"":4,""mcq_options"":null}"
"2337","234","337","Explain the concept of chain isomerism with examples.","FRQ","3","{""question_number"":""337"",""question_text"":""Explain the concept of chain isomerism with examples."",""question_type"":""FRQ"",""marks"":3,""mcq_options"":null}"
"2338","234","338","Describe the process of making platinum.","FRQ","4","{""question_number"":""338"",""question_text"":""Describe the process of making platinum."",""question_type"":""FRQ"",""marks"":4,""mcq_options"":null}"
"2339","234","339","Explain the concept of thermal pollution and its effects.","FRQ","4","{""question_number"":""339"",""question_text"":""Explain the concept of thermal pollution and its effects."",""question_type"":""FRQ"",""marks"":4,""mcq_options"":null}"
"2340","234","340","Describe the properties and uses of halogenoalkanes.","FRQ","4","{""question_number"":""340"",""question_text"":""Describe the properties and uses of halogenoalkanes."",""question_type"":""FRQ"",""marks"":4,""mcq_options"":null}"
"2341","235","341","Explain the concept of atom economy and how to calculate it.","FRQ","3","{""question_number"":""341"",""question_text"":""Explain the concept of atom economy and how to calculate it."",""question_type"":""FRQ"",""marks"":3,""mcq_options"":null}"
"2342","235","342","Describe the process of making polystyrene.","FRQ","4","{""question_number"":""342"",""question_text"":""Describe the process of making polystyrene."",""question_type"":""FRQ"",""marks"":4,""mcq_options"":null}"
"2343","235","343","Explain the concept of corrosion with examples.","FRQ","4","{""question_number"":""343"",""question_text"":""Explain the concept of corrosion with examples."",""question_type"":""FRQ"",""marks"":4,""mcq_options"":null}"
"2344","235","344","Describe the structure and properties of ceramics.","FRQ","4","{""question_number"":""344"",""question_text"":""Describe the structure and properties of ceramics."",""question_type"":""FRQ"",""marks"":4,""mcq_options"":null}"
"2345","235","345","Explain the process of making chlorine gas in the laboratory.","FRQ","3","{""question_number"":""345"",""question_text"":""Explain the process of making chlorine gas in the laboratory."",""question_type"":""FRQ"",""marks"":3,""mcq_options"":null}"
"2346","235","346","Describe the properties and uses of alcohols.","FRQ","4","{""question_number"":""346"",""question_text"":""Describe the properties and uses of alcohols."",""question_type"":""FRQ"",""marks"":4,""mcq_options"":null}"
"2347","235","347","Explain the concept of position isomerism with examples.","FRQ","3","{""question_number"":""347"",""question_text"":""Explain the concept of position isomerism with examples."",""question_type"":""FRQ"",""marks"":3,""mcq_options"":null}"
"2348","235","348","Describe the process of making titanium.","FRQ","4","{""question_number"":""348"",""question_text"":""Describe the process of making titanium."",""question_type"":""FRQ"",""marks"":4,""mcq_options"":null}"
"2349","235","349","Explain the concept of radioactive pollution and its effects.","FRQ","4","{""question_number"":""349"",""question_text"":""Explain the concept of radioactive pollution and its effects."",""question_type"":""FRQ"",""marks"":4,""mcq_options"":null}"
"2350","235","350","Describe the properties and uses of amines.","FRQ","4","{""question_number"":""350"",""question_text"":""Describe the properties and uses of amines."",""question_type"":""FRQ"",""marks"":4,""mcq_options"":null}"
"2351","236","351","Explain the concept of percentage composition and how to calculate it.","FRQ","3","{""question_number"":""351"",""question_text"":""Explain the concept of percentage composition and how to calculate it."",""question_type"":""FRQ"",""marks"":3,""mcq_options"":null}"
"2352","236","352","Describe the process of making polyamides.","FRQ","4","{""question_number"":""352"",""question_text"":""Describe the process of making polyamides."",""question_type"":""FRQ"",""marks"":4,""mcq_options"":null}"
"2353","236","353","Explain the concept of galvanic cells with examples.","FRQ","4","{""question_number"":""353"",""question_text"":""Explain the concept of galvanic cells with examples."",""question_type"":""FRQ"",""marks"":4,""mcq_options"":null}"
"2354","236","354","Describe the structure and properties of composites.","FRQ","4","{""question_number"":""354"",""question_text"":""Describe the structure and properties of composites."",""question_type"":""FRQ"",""marks"":4,""mcq_options"":null}"
"2355","236","355","Explain the process of making sulfur dioxide gas in the laboratory.","FRQ","3","{""question_number"":""355"",""question_text"":""Explain the process of making sulfur dioxide gas in the laboratory."",""question_type"":""FRQ"",""marks"":3,""mcq_options"":null}"
"2356","236","356","Describe the properties and uses of phenols.","FRQ","4","{""question_number"":""356"",""question_text"":""Describe the properties and uses of phenols."",""question_type"":""FRQ"",""marks"":4,""mcq_options"":null}"
"2357","236","357","Explain the concept of functional group isomerism with examples.","FRQ","3","{""question_number"":""357"",""question_text"":""Explain the concept of functional group isomerism with examples."",""question_type"":""FRQ"",""marks"":3,""mcq_options"":null}"
"2358","236","358","Describe the process of making tungsten.","FRQ","4","{""question_number"":""358"",""question_text"":""Describe the process of making tungsten."",""question_type"":""FRQ"",""marks"":4,""mcq_options"":null}"
"2359","236","359","Explain the concept of light pollution and its effects.","FRQ","4","{""question_number"":""359"",""question_text"":""Explain the concept of light pollution and its effects."",""question_type"":""FRQ"",""marks"":4,""mcq_options"":null}"
"2360","236","360","Describe the properties and uses of ethers.","FRQ","4","{""question_number"":""360"",""question_text"":""Describe the properties and uses of ethers."",""question_type"":""FRQ"",""marks"":4,""mcq_options"":null}"
"2361","237","361","Explain the concept of volumetric analysis and titration.","FRQ","4","{""question_number"":""361"",""question_text"":""Explain the concept of volumetric analysis and titration."",""question_type"":""FRQ"",""marks"":4,""mcq_options"":null}"
"2362","237","362","Describe the process of making polyesters.","FRQ","4","{""question_number"":""362"",""question_text"":""Describe the process of making polyesters."",""question_type"":""FRQ"",""marks"":4,""mcq_options"":null}"
"2363","237","363","Explain the concept of electrolytic cells with examples.","FRQ","4","{""question_number"":""363"",""question_text"":""Explain the concept of electrolytic cells with examples."",""question_type"":""FRQ"",""marks"":4,""mcq_options"":null}"
"2364","237","364","Describe the structure and properties of nanomaterials.","FRQ","4","{""question_number"":""364"",""question_text"":""Describe the structure and properties of nanomaterials."",""question_type"":""FRQ"",""marks"":4,""mcq_options"":null}"
"2365","237","365","Explain the process of making nitrogen dioxide gas in the laboratory.","FRQ","3","{""question_number"":""365"",""question_text"":""Explain the process of making nitrogen dioxide gas in the laboratory."",""question_type"":""FRQ"",""marks"":3,""mcq_options"":null}"
"2366","237","366","Describe the properties and uses of aldehydes.","FRQ","4","{""question_number"":""366"",""question_text"":""Describe the properties and uses of aldehydes."",""question_type"":""FRQ"",""marks"":4,""mcq_options"":null}"
"2367","237","367","Explain the concept of chain isomerism with examples.","FRQ","3","{""question_number"":""367"",""question_text"":""Explain the concept of chain isomerism with examples."",""question_type"":""FRQ"",""marks"":3,""mcq_options"":null}"
"2368","237","368","Describe the process of making uranium.","FRQ","4","{""question_number"":""368"",""question_text"":""Describe the process of making uranium."",""question_type"":""FRQ"",""marks"":4,""mcq_options"":null}"
"2369","237","369","Explain the concept of noise pollution and its effects.","FRQ","4","{""question_number"":""369"",""question_text"":""Explain the concept of noise pollution and its effects."",""question_type"":""FRQ"",""marks"":4,""mcq_options"":null}"
"2370","237","370","Describe the properties and uses of ketones.","FRQ","4","{""question_number"":""370"",""question_text"":""Describe the properties and uses of ketones."",""question_type"":""FRQ"",""marks"":4,""mcq_options"":null}"
"2371","238","371","Explain the concept of gas laws (Boyle's, Charles', and Gay-Lussac's laws).","FRQ","4","{""question_number"":""371"",""question_text"":""Explain the concept of gas laws (Boyle's, Charles', and Gay-Lussac's laws)."",""question_type"":""FRQ"",""marks"":4,""mcq_options"":null}"
"2372","238","372","Describe the process of making polyurethanes.","FRQ","4","{""question_number"":""372"",""question_text"":""Describe the process of making polyurethanes."",""question_type"":""FRQ"",""marks"":4,""mcq_options"":null}"
"2373","238","373","Explain the concept of standard electrode potentials with examples.","FRQ","4","{""question_number"":""373"",""question_text"":""Explain the concept of standard electrode potentials with examples."",""question_type"":""FRQ"",""marks"":4,""mcq_options"":null}"
"2374","238","374","Describe the structure and properties of smart materials.","FRQ","4","{""question_number"":""374"",""question_text"":""Describe the structure and properties of smart materials."",""question_type"":""FRQ"",""marks"":4,""mcq_options"":null}"
"2375","238","375","Explain the process of making hydrogen sulfide gas in the laboratory.","FRQ","3","{""question_number"":""375"",""question_text"":""Explain the process of making hydrogen sulfide gas in the laboratory."",""question_type"":""FRQ"",""marks"":3,""mcq_options"":null}"
"2376","238","376","Describe the properties and uses of carboxylic acids.","FRQ","4","{""question_number"":""376"",""question_text"":""Describe the properties and uses of carboxylic acids."",""question_type"":""FRQ"",""marks"":4,""mcq_options"":null}"
