"id","paperId","questionNumber","questionText","questionType","marks","rawLlMExtractedQuestion"
"3088","309","88","Which type of antenna radiates equally in all directions?","MCQ","1","{""question_number"":""88"",""question_text"":""Which type of antenna radiates equally in all directions?"",""question_type"":""MCQ"",""marks"":1,""mcq_options"":[""A. Dipole antenna"",""B. Isotropic antenna"",""C. Yagi antenna"",""D. Parabolic antenna""]}"
"3089","309","89","What is the gravitational potential at infinity?","MCQ","1","{""question_number"":""89"",""question_text"":""What is the gravitational potential at infinity?"",""question_type"":""MCQ"",""marks"":1,""mcq_options"":[""A. Zero"",""B. Infinite"",""C. Negative"",""D. Positive""]}"
"3090","309","90","Which process occurs at constant temperature?","MCQ","1","{""question_number"":""90"",""question_text"":""Which process occurs at constant temperature?"",""question_type"":""MCQ"",""marks"":1,""mcq_options"":[""A. Isothermal"",""B. Adiabatic"",""C. Isobaric"",""D. Isochoric""]}"
"3091","310","91","Explain the concept of uniform circular motion and the forces involved.","FRQ","4","{""question_number"":""91"",""question_text"":""Explain the concept of uniform circular motion and the forces involved."",""question_type"":""FRQ"",""marks"":4,""mcq_options"":null}"
"3092","310","92","Describe the structure and function of an operational amplifier.","FRQ","5","{""question_number"":""92"",""question_text"":""Describe the structure and function of an operational amplifier."",""question_type"":""FRQ"",""marks"":5,""mcq_options"":null}"
"3093","310","93","Explain the concept of thermal conductivity and its applications.","FRQ","4","{""question_number"":""93"",""question_text"":""Explain the concept of thermal conductivity and its applications."",""question_type"":""FRQ"",""marks"":4,""mcq_options"":null}"
"3094","310","94","Describe the structure and function of a flip-flop circuit.","FRQ","5","{""question_number"":""94"",""question_text"":""Describe the structure and function of a flip-flop circuit."",""question_type"":""FRQ"",""marks"":5,""mcq_options"":null}"
"3095","310","95","Explain the concept of nuclear binding energy and mass defect.","FRQ","5","{""question_number"":""95"",""question_text"":""Explain the concept of nuclear binding energy and mass defect."",""question_type"":""FRQ"",""marks"":5,""mcq_options"":null}"
"3096","310","96","Describe the principles of operation of an electric generator.","FRQ","5","{""question_number"":""96"",""question_text"":""Describe the principles of operation of an electric generator."",""question_type"":""FRQ"",""marks"":5,""mcq_options"":null}"
"3097","310","97","Explain the concept of quantum mechanics and the uncertainty principle.","FRQ","5","{""question_number"":""97"",""question_text"":""Explain the concept of quantum mechanics and the uncertainty principle."",""question_type"":""FRQ"",""marks"":5,""mcq_options"":null}"
"3098","310","98","Describe the structure and function of a transistor amplifier.","FRQ","5","{""question_number"":""98"",""question_text"":""Describe the structure and function of a transistor amplifier."",""question_type"":""FRQ"",""marks"":5,""mcq_options"":null}"
"3099","310","99","Explain the concept of entropy and the second law of thermodynamics.","FRQ","5","{""question_number"":""99"",""question_text"":""Explain the concept of entropy and the second law of thermodynamics."",""question_type"":""FRQ"",""marks"":5,""mcq_options"":null}"
"3100","310","100","Describe the principles of operation of a particle accelerator.","FRQ","5","{""question_number"":""100"",""question_text"":""Describe the principles of operation of a particle accelerator."",""question_type"":""FRQ"",""marks"":5,""mcq_options"":null}"
"3101","311","101","What is the SI unit of magnetic moment?","MCQ","1","{""question_number"":""101"",""question_text"":""What is the SI unit of magnetic moment?"",""question_type"":""MCQ"",""marks"":1,""mcq_options"":[""A. A·m²"",""B. Wb·m"",""C. T·m³"",""D. H·A""]}"
"3102","311","102","Which effect explains the splitting of spectral lines in magnetic fields?","MCQ","1","{""question_number"":""102"",""question_text"":""Which effect explains the splitting of spectral lines in magnetic fields?"",""question_type"":""MCQ"",""marks"":1,""mcq_options"":[""A. Doppler effect"",""B. Zeeman effect"",""C. Stark effect"",""D. Compton effect""]}"
"3103","311","103","What is the mirror formula?","MCQ","1","{""question_number"":""103"",""question_text"":""What is the mirror formula?"",""question_type"":""MCQ"",""marks"":1,""mcq_options"":[""A. 1/f = 1/u + 1/v"",""B. 1/f = 1/u - 1/v"",""C. f = u + v"",""D. f = u - v""]}"
"3104","311","104","Which gate gives output 1 when all inputs are 1?","MCQ","1","{""question_number"":""104"",""question_text"":""Which gate gives output 1 when all inputs are 1?"",""question_type"":""MCQ"",""marks"":1,""mcq_options"":[""A. OR gate"",""B. AND gate"",""C. NAND gate"",""D. NOR gate""]}"
"3105","311","105","What is the formula for centripetal acceleration?","MCQ","1","{""question_number"":""105"",""question_text"":""What is the formula for centripetal acceleration?"",""question_type"":""MCQ"",""marks"":1,""mcq_options"":[""A. a = v²/r"",""B. a = vr"",""C. a = v/r"",""D. a = r/v""]}"
"3106","311","106","Which phenomenon explains the mirage effect?","MCQ","1","{""question_number"":""106"",""question_text"":""Which phenomenon explains the mirage effect?"",""question_type"":""MCQ"",""marks"":1,""mcq_options"":[""A. Reflection"",""B. Total internal reflection"",""C. Refraction"",""D. Scattering""]}"
"3107","311","107","What is the SI unit of electric dipole moment?","MCQ","1","{""question_number"":""107"",""question_text"":""What is the SI unit of electric dipole moment?"",""question_type"":""MCQ"",""marks"":1,""mcq_options"":[""A. C·m"",""B. C/m"",""C. C·m²"",""D. C²·m""]}"
"3108","311","108","Which modulation technique is most resistant to noise?","MCQ","1","{""question_number"":""108"",""question_text"":""Which modulation technique is most resistant to noise?"",""question_type"":""MCQ"",""marks"":1,""mcq_options"":[""A. AM"",""B. FM"",""C. PM"",""D. Digital modulation""]}"
"3109","311","109","What is the second cosmic velocity?","MCQ","1","{""question_number"":""109"",""question_text"":""What is the second cosmic velocity?"",""question_type"":""MCQ"",""marks"":1,""mcq_options"":[""A. 7.9 km/s"",""B. 11.2 km/s"",""C. 16.7 km/s"",""D. 42.1 km/s""]}"
"3110","311","110","Which process occurs at constant volume?","MCQ","1","{""question_number"":""110"",""question_text"":""Which process occurs at constant volume?"",""question_type"":""MCQ"",""marks"":1,""mcq_options"":[""A. Isothermal"",""B. Adiabatic"",""C. Isobaric"",""D. Isochoric""]}"
"3111","312","111","Explain the concept of rotational motion and moment of inertia.","FRQ","4","{""question_number"":""111"",""question_text"":""Explain the concept of rotational motion and moment of inertia."",""question_type"":""FRQ"",""marks"":4,""mcq_options"":null}"
"3112","312","112","Describe the structure and function of an inductor in a circuit.","FRQ","5","{""question_number"":""112"",""question_text"":""Describe the structure and function of an inductor in a circuit."",""question_type"":""FRQ"",""marks"":5,""mcq_options"":null}"
"3113","312","113","Explain the concept of thermal equilibrium and the zeroth law of thermodynamics.","FRQ","4","{""question_number"":""113"",""question_text"":""Explain the concept of thermal equilibrium and the zeroth law of thermodynamics."",""question_type"":""FRQ"",""marks"":4,""mcq_options"":null}"
"3114","312","114","Describe the structure and function of a microprocessor.","FRQ","5","{""question_number"":""114"",""question_text"":""Describe the structure and function of a microprocessor."",""question_type"":""FRQ"",""marks"":5,""mcq_options"":null}"
"3115","312","115","Explain the concept of nuclear fusion and its challenges.","FRQ","5","{""question_number"":""115"",""question_text"":""Explain the concept of nuclear fusion and its challenges."",""question_type"":""FRQ"",""marks"":5,""mcq_options"":null}"
"3116","312","116","Describe the principles of operation of a laser.","FRQ","5","{""question_number"":""116"",""question_text"":""Describe the principles of operation of a laser."",""question_type"":""FRQ"",""marks"":5,""mcq_options"":null}"
"3117","312","117","Explain the concept of quantum tunneling and its applications.","FRQ","5","{""question_number"":""117"",""question_text"":""Explain the concept of quantum tunneling and its applications."",""question_type"":""FRQ"",""marks"":5,""mcq_options"":null}"
"3118","312","118","Describe the structure and function of a field effect transistor (FET).","FRQ","5","{""question_number"":""118"",""question_text"":""Describe the structure and function of a field effect transistor (FET)."",""question_type"":""FRQ"",""marks"":5,""mcq_options"":null}"
"3119","312","119","Explain the concept of heat engines and the Carnot cycle.","FRQ","5","{""question_number"":""119"",""question_text"":""Explain the concept of heat engines and the Carnot cycle."",""question_type"":""FRQ"",""marks"":5,""mcq_options"":null}"
"3120","312","120","Describe the principles of operation of a mass spectrometer.","FRQ","5","{""question_number"":""120"",""question_text"":""Describe the principles of operation of a mass spectrometer."",""question_type"":""FRQ"",""marks"":5,""mcq_options"":null}"
"3121","313","121","What is the SI unit of dose equivalent?","MCQ","1","{""question_number"":""121"",""question_text"":""What is the SI unit of dose equivalent?"",""question_type"":""MCQ"",""marks"":1,""mcq_options"":[""A. Gray"",""B. Sievert"",""C. Becquerel"",""D. Roentgen""]}"
"3122","313","122","Which force mediates the strong nuclear interaction?","MCQ","1","{""question_number"":""122"",""question_text"":""Which force mediates the strong nuclear interaction?"",""question_type"":""MCQ"",""marks"":1,""mcq_options"":[""A. Photon"",""B. Gluon"",""C. W boson"",""D. Z boson""]}"
"3123","313","123","What is the condition for destructive interference?","MCQ","1","{""question_number"":""123"",""question_text"":""What is the condition for destructive interference?"",""question_type"":""MCQ"",""marks"":1,""mcq_options"":[""A. Path difference = nλ"",""B. Path difference = (n+1/2)λ"",""C. Path difference = 2nλ"",""D. Path difference = λ/4""]}"
"3124","313","124","Which device emits coherent light?","MCQ","1","{""question_number"":""124"",""question_text"":""Which device emits coherent light?"",""question_type"":""MCQ"",""marks"":1,""mcq_options"":[""A. LED"",""B. Laser"",""C. Incandescent bulb"",""D. Fluorescent tube""]}"
"3125","313","125","What is the time period of a simple pendulum?","MCQ","1","{""question_number"":""125"",""question_text"":""What is the time period of a simple pendulum?"",""question_type"":""MCQ"",""marks"":1,""mcq_options"":[""A. T = 2π√(l/g)"",""B. T = 2π√(g/l)"",""C. T = π√(l/g)"",""D. T = √(l/g)""]}"
"3126","313","126","Which phenomenon explains the operation of optical fibers?","MCQ","1","{""question_number"":""126"",""question_text"":""Which phenomenon explains the operation of optical fibers?"",""question_type"":""MCQ"",""marks"":1,""mcq_options"":[""A. Reflection"",""B. Refraction"",""C. Total internal reflection"",""D. Scattering""]}"
"3127","313","127","What is the SI unit of exposure to radiation?","MCQ","1","{""question_number"":""127"",""question_text"":""What is the SI unit of exposure to radiation?"",""question_type"":""MCQ"",""marks"":1,""mcq_options"":[""A. Coulomb per kilogram"",""B. Gray"",""C. Sievert"",""D. Becquerel""]}"
"3128","313","128","Which type of semiconductor has excess holes?","MCQ","1","{""question_number"":""128"",""question_text"":""Which type of semiconductor has excess holes?"",""question_type"":""MCQ"",""marks"":1,""mcq_options"":[""A. p-type"",""B. n-type"",""C. Intrinsic"",""D. Compound""]}"
"3129","313","129","What is the velocity needed to escape the solar system?","MCQ","1","{""question_number"":""129"",""question_text"":""What is the velocity needed to escape the solar system?"",""question_type"":""MCQ"",""marks"":1,""mcq_options"":[""A. 7.9 km/s"",""B. 11.2 km/s"",""C. 16.7 km/s"",""D. 42.1 km/s""]}"
"3130","313","130","Which law relates the efficiency of heat engines?","MCQ","1","{""question_number"":""130"",""question_text"":""Which law relates the efficiency of heat engines?"",""question_type"":""MCQ"",""marks"":1,""mcq_options"":[""A. First law of thermodynamics"",""B. Second law of thermodynamics"",""C. Zeroth law of thermodynamics"",""D. Third law of thermodynamics""]}"
"3131","314","131","Explain the concept of angular momentum and its conservation.","FRQ","4","{""question_number"":""131"",""question_text"":""Explain the concept of angular momentum and its conservation."",""question_type"":""FRQ"",""marks"":4,""mcq_options"":null}"
"3132","314","132","Describe the structure and function of an RLC circuit.","FRQ","5","{""question_number"":""132"",""question_text"":""Describe the structure and function of an RLC circuit."",""question_type"":""FRQ"",""marks"":5,""mcq_options"":null}"
"3133","314","133","Explain the concept of heat capacity and specific heat capacity.","FRQ","4","{""question_number"":""133"",""question_text"":""Explain the concept of heat capacity and specific heat capacity."",""question_type"":""FRQ"",""marks"":4,""mcq_options"":null}"
"3134","314","134","Describe the structure and function of a microcontroller.","FRQ","5","{""question_number"":""134"",""question_text"":""Describe the structure and function of a microcontroller."",""question_type"":""FRQ"",""marks"":5,""mcq_options"":null}"
"3135","314","135","Explain the concept of nuclear stability and the factors affecting it.","FRQ","5","{""question_number"":""135"",""question_text"":""Explain the concept of nuclear stability and the factors affecting it."",""question_type"":""FRQ"",""marks"":5,""mcq_options"":null}"
"3136","314","136","Describe the principles of operation of a photodiode.","FRQ","5","{""question_number"":""136"",""question_text"":""Describe the principles of operation of a photodiode."",""question_type"":""FRQ"",""marks"":5,""mcq_options"":null}"
"3137","314","137","Explain the concept of quantum states and energy levels in atoms.","FRQ","5","{""question_number"":""137"",""question_text"":""Explain the concept of quantum states and energy levels in atoms."",""question_type"":""FRQ"",""marks"":5,""mcq_options"":null}"
"3138","314","138","Describe the structure and function of an operational amplifier.","FRQ","5","{""question_number"":""138"",""question_text"":""Describe the structure and function of an operational amplifier."",""question_type"":""FRQ"",""marks"":5,""mcq_options"":null}"
"3139","314","139","Explain the concept of thermodynamic cycles and their efficiency.","FRQ","5","{""question_number"":""139"",""question_text"":""Explain the concept of thermodynamic cycles and their efficiency."",""question_type"":""FRQ"",""marks"":5,""mcq_options"":null}"
"3140","314","140","Describe the principles of operation of a nuclear magnetic resonance (NMR) machine.","FRQ","5","{""question_number"":""140"",""question_text"":""Describe the principles of operation of a nuclear magnetic resonance (NMR) machine."",""question_type"":""FRQ"",""marks"":5,""mcq_options"":null}"
"3141","315","141","What is the decay constant of a radioactive substance?","MCQ","1","{""question_number"":""141"",""question_text"":""What is the decay constant of a radioactive substance?"",""question_type"":""MCQ"",""marks"":1,""mcq_options"":[""A. Probability of decay per unit time"",""B. Number of decays per second"",""C. Half-life"",""D. Mean life""]}"
"3142","315","142","Which particle has no mass?","MCQ","1","{""question_number"":""142"",""question_text"":""Which particle has no mass?"",""question_type"":""MCQ"",""marks"":1,""mcq_options"":[""A. Electron"",""B. Proton"",""C. Photon"",""D. Neutron""]}"
"3143","315","143","What is the numerical aperture of an optical fiber?","MCQ","1","{""question_number"":""143"",""question_text"":""What is the numerical aperture of an optical fiber?"",""question_type"":""MCQ"",""marks"":1,""mcq_options"":[""A. Light gathering ability"",""B. Acceptance angle"",""C. Core diameter"",""D. Refractive index""]}"
"3144","315","144","Which device amplifies current?","MCQ","1","{""question_number"":""144"",""question_text"":""Which device amplifies current?"",""question_type"":""MCQ"",""marks"":1,""mcq_options"":[""A. Diode"",""B. Transistor"",""C. Resistor"",""D. Capacitor""]}"
"3145","315","145","What is the restoring force in simple harmonic motion?","MCQ","1","{""question_number"":""145"",""question_text"":""What is the restoring force in simple harmonic motion?"",""question_type"":""MCQ"",""marks"":1,""mcq_options"":[""A. F = -kx"",""B. F = kx"",""C. F = -kx²"",""D. F = kx²""]}"
"3146","315","146","Which phenomenon explains the operation of LCD displays?","MCQ","1","{""question_number"":""146"",""question_text"":""Which phenomenon explains the operation of LCD displays?"",""question_type"":""MCQ"",""marks"":1,""mcq_options"":[""A. Reflection"",""B. Refraction"",""C. Polarization"",""D. Emission""]}"
"3147","315","147","What is the mass-energy equivalence formula?","MCQ","1","{""question_number"":""147"",""question_text"":""What is the mass-energy equivalence formula?"",""question_type"":""MCQ"",""marks"":1,""mcq_options"":[""A. E = mc"",""B. E = mc²"",""C. E = m²c"",""D. E = m/c²""]}"
"3148","315","148","Which type of bias is used for amplification in transistors?","MCQ","1","{""question_number"":""148"",""question_text"":""Which type of bias is used for amplification in transistors?"",""question_type"":""MCQ"",""marks"":1,""mcq_options"":[""A. Forward bias"",""B. Reverse bias"",""C. Zero bias"",""D. Both forward and reverse""]}"
"3149","315","149","What is the Hubble constant?","MCQ","1","{""question_number"":""149"",""question_text"":""What is the Hubble constant?"",""question_type"":""MCQ"",""marks"":1,""mcq_options"":[""A. Rate of expansion of universe"",""B. Age of universe"",""C. Size of universe"",""D. Density of universe""]}"
"3150","315","150","Which law states that entropy always increases?","MCQ","1","{""question_number"":""150"",""question_text"":""Which law states that entropy always increases?"",""question_type"":""MCQ"",""marks"":1,""mcq_options"":[""A. First law of thermodynamics"",""B. Second law of thermodynamics"",""C. Zeroth law of thermodynamics"",""D. Third law of thermodynamics""]}"
"3151","316","151","Explain the concept of elastic and inelastic collisions.","FRQ","4","{""question_number"":""151"",""question_text"":""Explain the concept of elastic and inelastic collisions."",""question_type"":""FRQ"",""marks"":4,""mcq_options"":null}"
"3152","316","152","Describe the structure and function of a filter circuit.","FRQ","5","{""question_number"":""152"",""question_text"":""Describe the structure and function of a filter circuit."",""question_type"":""FRQ"",""marks"":5,""mcq_options"":null}"
"3153","316","153","Explain the concept of thermal expansion in solids, liquids, and gases.","FRQ","4","{""question_number"":""153"",""question_text"":""Explain the concept of thermal expansion in solids, liquids, and gases."",""question_type"":""FRQ"",""marks"":4,""mcq_options"":null}"
"3154","316","154","Describe the structure and function of a digital-to-analog converter (DAC).","FRQ","5","{""question_number"":""154"",""question_text"":""Describe the structure and function of a digital-to-analog converter (DAC)."",""question_type"":""FRQ"",""marks"":5,""mcq_options"":null}"
"3155","316","155","Explain the concept of nuclear reactions and their energy release.","FRQ","5","{""question_number"":""155"",""question_text"":""Explain the concept of nuclear reactions and their energy release."",""question_type"":""FRQ"",""marks"":5,""mcq_options"":null}"
"3156","316","156","Describe the principles of operation of a photovoltaic cell.","FRQ","5","{""question_number"":""156"",""question_text"":""Describe the principles of operation of a photovoltaic cell."",""question_type"":""FRQ"",""marks"":5,""mcq_options"":null}"
"3157","316","157","Explain the concept of quantum entanglement and its implications.","FRQ","5","{""question_number"":""157"",""question_text"":""Explain the concept of quantum entanglement and its implications."",""question_type"":""FRQ"",""marks"":5,""mcq_options"":null}"
"3158","316","158","Describe the structure and function of a MOSFET.","FRQ","5","{""question_number"":""158"",""question_text"":""Describe the structure and function of a MOSFET."",""question_type"":""FRQ"",""marks"":5,""mcq_options"":null}"
"3159","316","159","Explain the concept of refrigeration cycles and their efficiency.","FRQ","5","{""question_number"":""159"",""question_text"":""Explain the concept of refrigeration cycles and their efficiency."",""question_type"":""FRQ"",""marks"":5,""mcq_options"":null}"
"3160","316","160","Describe the principles of operation of a scanning electron microscope (SEM).","FRQ","5","{""question_number"":""160"",""question_text"":""Describe the principles of operation of a scanning electron microscope (SEM)."",""question_type"":""FRQ"",""marks"":5,""mcq_options"":null}"
"3161","317","161","What is the Q-value of a nuclear reaction?","MCQ","1","{""question_number"":""161"",""question_text"":""What is the Q-value of a nuclear reaction?"",""question_type"":""MCQ"",""marks"":1,""mcq_options"":[""A. Energy released"",""B. Mass defect"",""C. Binding energy"",""D. Kinetic energy""]}"
"3162","317","162","Which particle is its own antiparticle?","MCQ","1","{""question_number"":""162"",""question_text"":""Which particle is its own antiparticle?"",""question_type"":""MCQ"",""marks"":1,""mcq_options"":[""A. Electron"",""B. Proton"",""C. Photon"",""D. Neutron""]}"
"3163","317","163","What is the step index profile in optical fibers?","MCQ","1","{""question_number"":""163"",""question_text"":""What is the step index profile in optical fibers?"",""question_type"":""MCQ"",""marks"":1,""mcq_options"":[""A. Constant refractive index in core"",""B. Gradually varying refractive index"",""C. Parabolic index profile"",""D. Linear index profile""]}"
"3164","317","164","Which parameter determines the current gain of a transistor?","MCQ","1","{""question_number"":""164"",""question_text"":""Which parameter determines the current gain of a transistor?"",""question_type"":""MCQ"",""marks"":1,""mcq_options"":[""A. Alpha"",""B. Beta"",""C. Gamma"",""D. Delta""]}"
"3165","317","165","What is the phase difference between displacement and acceleration in SHM?","MCQ","1","{""question_number"":""165"",""question_text"":""What is the phase difference between displacement and acceleration in SHM?"",""question_type"":""MCQ"",""marks"":1,""mcq_options"":[""A. 0°"",""B. 90°"",""C. 180°"",""D. 270°""]}"
"3166","317","166","Which type of aberration affects image quality in lenses?","MCQ","1","{""question_number"":""166"",""question_text"":""Which type of aberration affects image quality in lenses?"",""question_type"":""MCQ"",""marks"":1,""mcq_options"":[""A. Spherical aberration"",""B. Chromatic aberration"",""C. Both A and B"",""D. Astigmatism""]}"
"3167","317","167","What is the de Broglie wavelength?","MCQ","1","{""question_number"":""167"",""question_text"":""What is the de Broglie wavelength?"",""question_type"":""MCQ"",""marks"":1,""mcq_options"":[""A. λ = h/p"",""B. λ = p/h"",""C. λ = hp"",""D. λ = h + p""]}"
"3168","317","168","Which material is used as dopant for p-type semiconductor?","MCQ","1","{""question_number"":""168"",""question_text"":""Which material is used as dopant for p-type semiconductor?"",""question_type"":""MCQ"",""marks"":1,""mcq_options"":[""A. Phosphorus"",""B. Boron"",""C. Arsenic"",""D. Antimony""]}"
"3169","317","169","What is the cosmic microwave background radiation?","MCQ","1","{""question_number"":""169"",""question_text"":""What is the cosmic microwave background radiation?"",""question_type"":""MCQ"",""marks"":1,""mcq_options"":[""A. Radiation from stars"",""B. Remnant of Big Bang"",""C. Solar radiation"",""D. Galactic radiation""]}"
"3170","317","170","Which law relates heat capacity and temperature?","MCQ","1","{""question_number"":""170"",""question_text"":""Which law relates heat capacity and temperature?"",""question_type"":""MCQ"",""marks"":1,""mcq_options"":[""A. Dulong-Petit law"",""B. Stefan-Boltzmann law"",""C. Wien's law"",""D. Planck's law""]}"
"3171","318","171","Explain the concept of equilibrium and the conditions for equilibrium.","FRQ","4","{""question_number"":""171"",""question_text"":""Explain the concept of equilibrium and the conditions for equilibrium."",""question_type"":""FRQ"",""marks"":4,""mcq_options"":null}"
"3172","318","172","Describe the structure and function of a rectifier circuit.","FRQ","5","{""question_number"":""172"",""question_text"":""Describe the structure and function of a rectifier circuit."",""question_type"":""FRQ"",""marks"":5,""mcq_options"":null}"
"3173","318","173","Explain the concept of thermal radiation and black body radiation.","FRQ","4","{""question_number"":""173"",""question_text"":""Explain the concept of thermal radiation and black body radiation."",""question_type"":""FRQ"",""marks"":4,""mcq_options"":null}"
"3174","318","174","Describe the structure and function of an analog-to-digital converter (ADC).","FRQ","5","{""question_number"":""174"",""question_text"":""Describe the structure and function of an analog-to-digital converter (ADC)."",""question_type"":""FRQ"",""marks"":5,""mcq_options"":null}"
