"id","paperId","questionNumber","questionText","questionType","marks","rawLlMExtractedQuestion"
"3001","301","1","What is the SI unit of electric current?","MCQ","1","{""question_number"":""1"",""question_text"":""What is the SI unit of electric current?"",""question_type"":""MCQ"",""marks"":1,""mcq_options"":[""A. Ampere"",""B. Volt"",""C. Ohm"",""D. Watt""]}"
"3002","301","2","Which law states that the current through a conductor is proportional to the voltage?","MCQ","1","{""question_number"":""2"",""question_text"":""Which law states that the current through a conductor is proportional to the voltage?"",""question_type"":""MCQ"",""marks"":1,""mcq_options"":[""A. Newton's law"",""B. Ohm's law"",""C. Faraday's law"",""D. Coulomb's law""]}"
"3003","301","3","What is the speed of light in vacuum?","MCQ","1","{""question_number"":""3"",""question_text"":""What is the speed of light in vacuum?"",""question_type"":""MCQ"",""marks"":1,""mcq_options"":[""A. 3 × 10⁸ m/s"",""B. 3 × 10⁶ m/s"",""C. 3 × 10⁷ m/s"",""D. 3 × 10⁹ m/s""]}"
"3004","301","4","Which type of wave requires a medium to travel?","MCQ","1","{""question_number"":""4"",""question_text"":""Which type of wave requires a medium to travel?"",""question_type"":""MCQ"",""marks"":1,""mcq_options"":[""A. Light wave"",""B. Radio wave"",""C. Sound wave"",""D. X-ray""]}"
"3005","301","5","What is the formula for kinetic energy?","MCQ","1","{""question_number"":""5"",""question_text"":""What is the formula for kinetic energy?"",""question_type"":""MCQ"",""marks"":1,""mcq_options"":[""A. KE = mv"",""B. KE = ½mv²"",""C. KE = mv²"",""D. KE = ½mv""]}"
"3006","301","6","Which particle has no electric charge?","MCQ","1","{""question_number"":""6"",""question_text"":""Which particle has no electric charge?"",""question_type"":""MCQ"",""marks"":1,""mcq_options"":[""A. Proton"",""B. Electron"",""C. Neutron"",""D. Ion""]}"
"3007","301","7","What is the acceleration due to gravity on Earth?","MCQ","1","{""question_number"":""7"",""question_text"":""What is the acceleration due to gravity on Earth?"",""question_type"":""MCQ"",""marks"":1,""mcq_options"":[""A. 9.8 m/s²"",""B. 10 m/s²"",""C. 8.9 m/s²"",""D. 11 m/s²""]}"
"3008","301","8","Which quantity is a vector?","MCQ","1","{""question_number"":""8"",""question_text"":""Which quantity is a vector?"",""question_type"":""MCQ"",""marks"":1,""mcq_options"":[""A. Speed"",""B. Distance"",""C. Velocity"",""D. Time""]}"
"3009","301","9","What happens to resistance when length of wire is doubled?","MCQ","1","{""question_number"":""9"",""question_text"":""What happens to resistance when length of wire is doubled?"",""question_type"":""MCQ"",""marks"":1,""mcq_options"":[""A. Halves"",""B. Doubles"",""C. Remains same"",""D. Quadruples""]}"
"3010","301","10","Which electromagnetic radiation has the highest frequency?","MCQ","1","{""question_number"":""10"",""question_text"":""Which electromagnetic radiation has the highest frequency?"",""question_type"":""MCQ"",""marks"":1,""mcq_options"":[""A. Radio waves"",""B. Visible light"",""C. X-rays"",""D. Gamma rays""]}"
"3011","302","11","What is the SI unit of power?","MCQ","1","{""question_number"":""11"",""question_text"":""What is the SI unit of power?"",""question_type"":""MCQ"",""marks"":1,""mcq_options"":[""A. Joule"",""B. Watt"",""C. Newton"",""D. Pascal""]}"
"3012","302","12","Which law relates force, mass, and acceleration?","MCQ","1","{""question_number"":""12"",""question_text"":""Which law relates force, mass, and acceleration?"",""question_type"":""MCQ"",""marks"":1,""mcq_options"":[""A. Newton's first law"",""B. Newton's second law"",""C. Newton's third law"",""D. Law of conservation""]}"
"3013","302","13","What is the frequency of a wave with wavelength 2m and speed 10 m/s?","MCQ","1","{""question_number"":""13"",""question_text"":""What is the frequency of a wave with wavelength 2m and speed 10 m/s?"",""question_type"":""MCQ"",""marks"":1,""mcq_options"":[""A. 5 Hz"",""B. 20 Hz"",""C. 12 Hz"",""D. 8 Hz""]}"
"3014","302","14","Which material is the best conductor of electricity?","MCQ","1","{""question_number"":""14"",""question_text"":""Which material is the best conductor of electricity?"",""question_type"":""MCQ"",""marks"":1,""mcq_options"":[""A. Copper"",""B. Silver"",""C. Gold"",""D. Aluminum""]}"
"3015","302","15","What is the formula for potential energy?","MCQ","1","{""question_number"":""15"",""question_text"":""What is the formula for potential energy?"",""question_type"":""MCQ"",""marks"":1,""mcq_options"":[""A. PE = mgh"",""B. PE = mg"",""C. PE = mh"",""D. PE = gh""]}"
"3016","302","16","Which force keeps planets in orbit around the sun?","MCQ","1","{""question_number"":""16"",""question_text"":""Which force keeps planets in orbit around the sun?"",""question_type"":""MCQ"",""marks"":1,""mcq_options"":[""A. Magnetic force"",""B. Electric force"",""C. Gravitational force"",""D. Nuclear force""]}"
"3017","302","17","What is the SI unit of frequency?","MCQ","1","{""question_number"":""17"",""question_text"":""What is the SI unit of frequency?"",""question_type"":""MCQ"",""marks"":1,""mcq_options"":[""A. Hertz"",""B. Meter"",""C. Second"",""D. Joule""]}"
"3018","302","18","Which type of lens converges light rays?","MCQ","1","{""question_number"":""18"",""question_text"":""Which type of lens converges light rays?"",""question_type"":""MCQ"",""marks"":1,""mcq_options"":[""A. Concave lens"",""B. Convex lens"",""C. Plane lens"",""D. Cylindrical lens""]}"
"3019","302","19","What happens to kinetic energy when speed doubles?","MCQ","1","{""question_number"":""19"",""question_text"":""What happens to kinetic energy when speed doubles?"",""question_type"":""MCQ"",""marks"":1,""mcq_options"":[""A. Doubles"",""B. Halves"",""C. Quadruples"",""D. Remains same""]}"
"3020","302","20","Which principle explains how airplanes fly?","MCQ","1","{""question_number"":""20"",""question_text"":""Which principle explains how airplanes fly?"",""question_type"":""MCQ"",""marks"":1,""mcq_options"":[""A. Archimedes' principle"",""B. Bernoulli's principle"",""C. Pascal's principle"",""D. Hooke's law""]}"
"3021","303","21","Explain the concept of momentum and how it is conserved in collisions.","FRQ","4","{""question_number"":""21"",""question_text"":""Explain the concept of momentum and how it is conserved in collisions."",""question_type"":""FRQ"",""marks"":4,""mcq_options"":null}"
"3022","303","22","Describe the structure of an atom and explain the properties of its subatomic particles.","FRQ","5","{""question_number"":""22"",""question_text"":""Describe the structure of an atom and explain the properties of its subatomic particles."",""question_type"":""FRQ"",""marks"":5,""mcq_options"":null}"
"3023","303","23","Explain the difference between series and parallel circuits, including their characteristics.","FRQ","4","{""question_number"":""23"",""question_text"":""Explain the difference between series and parallel circuits, including their characteristics."",""question_type"":""FRQ"",""marks"":4,""mcq_options"":null}"
"3024","303","24","Describe the electromagnetic spectrum and give examples of applications for different types of waves.","FRQ","5","{""question_number"":""24"",""question_text"":""Describe the electromagnetic spectrum and give examples of applications for different types of waves."",""question_type"":""FRQ"",""marks"":5,""mcq_options"":null}"
"3025","303","25","Explain Newton's laws of motion and give examples of each.","FRQ","6","{""question_number"":""25"",""question_text"":""Explain Newton's laws of motion and give examples of each."",""question_type"":""FRQ"",""marks"":6,""mcq_options"":null}"
"3026","303","26","Describe the process of nuclear fission and how it is used in nuclear power plants.","FRQ","5","{""question_number"":""26"",""question_text"":""Describe the process of nuclear fission and how it is used in nuclear power plants."",""question_type"":""FRQ"",""marks"":5,""mcq_options"":null}"
"3027","303","27","Explain the concept of specific heat capacity and how it affects temperature changes.","FRQ","4","{""question_number"":""27"",""question_text"":""Explain the concept of specific heat capacity and how it affects temperature changes."",""question_type"":""FRQ"",""marks"":4,""mcq_options"":null}"
"3028","303","28","Describe the properties of waves, including reflection, refraction, diffraction, and interference.","FRQ","6","{""question_number"":""28"",""question_text"":""Describe the properties of waves, including reflection, refraction, diffraction, and interference."",""question_type"":""FRQ"",""marks"":6,""mcq_options"":null}"
"3029","303","29","Explain the concept of work, energy, and power, and how they are related.","FRQ","5","{""question_number"":""29"",""question_text"":""Explain the concept of work, energy, and power, and how they are related."",""question_type"":""FRQ"",""marks"":5,""mcq_options"":null}"
"3030","303","30","Describe the principles of electromagnetism and how they are applied in electric motors.","FRQ","5","{""question_number"":""30"",""question_text"":""Describe the principles of electromagnetism and how they are applied in electric motors."",""question_type"":""FRQ"",""marks"":5,""mcq_options"":null}"
"3031","304","31","Explain the concept of pressure in fluids and how it varies with depth.","FRQ","4","{""question_number"":""31"",""question_text"":""Explain the concept of pressure in fluids and how it varies with depth."",""question_type"":""FRQ"",""marks"":4,""mcq_options"":null}"
"3032","304","32","Describe the structure and function of a transformer, including the principles of electromagnetic induction.","FRQ","5","{""question_number"":""32"",""question_text"":""Describe the structure and function of a transformer, including the principles of electromagnetic induction."",""question_type"":""FRQ"",""marks"":5,""mcq_options"":null}"
"3033","304","33","Explain the concept of thermal expansion and its applications.","FRQ","4","{""question_number"":""33"",""question_text"":""Explain the concept of thermal expansion and its applications."",""question_type"":""FRQ"",""marks"":4,""mcq_options"":null}"
"3034","304","34","Describe the structure and function of a cathode ray oscilloscope (CRO).","FRQ","5","{""question_number"":""34"",""question_text"":""Describe the structure and function of a cathode ray oscilloscope (CRO)."",""question_type"":""FRQ"",""marks"":5,""mcq_options"":null}"
"3035","304","35","Explain the concept of radioactive decay and half-life.","FRQ","4","{""question_number"":""35"",""question_text"":""Explain the concept of radioactive decay and half-life."",""question_type"":""FRQ"",""marks"":4,""mcq_options"":null}"
"3036","304","36","Describe the principles of operation of a DC motor.","FRQ","5","{""question_number"":""36"",""question_text"":""Describe the principles of operation of a DC motor."",""question_type"":""FRQ"",""marks"":5,""mcq_options"":null}"
"3037","304","37","Explain the concept of simple harmonic motion and give examples.","FRQ","4","{""question_number"":""37"",""question_text"":""Explain the concept of simple harmonic motion and give examples."",""question_type"":""FRQ"",""marks"":4,""mcq_options"":null}"
"3038","304","38","Describe the structure and function of a semiconductor diode.","FRQ","5","{""question_number"":""38"",""question_text"":""Describe the structure and function of a semiconductor diode."",""question_type"":""FRQ"",""marks"":5,""mcq_options"":null}"
"3039","304","39","Explain the concept of heat transfer through conduction, convection, and radiation.","FRQ","6","{""question_number"":""39"",""question_text"":""Explain the concept of heat transfer through conduction, convection, and radiation."",""question_type"":""FRQ"",""marks"":6,""mcq_options"":null}"
"3040","304","40","Describe the principles of operation of a nuclear reactor.","FRQ","5","{""question_number"":""40"",""question_text"":""Describe the principles of operation of a nuclear reactor."",""question_type"":""FRQ"",""marks"":5,""mcq_options"":null}"
"3041","305","41","What is the SI unit of capacitance?","MCQ","1","{""question_number"":""41"",""question_text"":""What is the SI unit of capacitance?"",""question_type"":""MCQ"",""marks"":1,""mcq_options"":[""A. Farad"",""B. Henry"",""C. Coulomb"",""D. Volt""]}"
"3042","305","42","Which effect describes the emission of electrons from metals?","MCQ","1","{""question_number"":""42"",""question_text"":""Which effect describes the emission of electrons from metals?"",""question_type"":""MCQ"",""marks"":1,""mcq_options"":[""A. Compton effect"",""B. Photoelectric effect"",""C. Doppler effect"",""D. Hall effect""]}"
"3043","305","43","What is the critical angle for total internal reflection in glass?","MCQ","1","{""question_number"":""43"",""question_text"":""What is the critical angle for total internal reflection in glass?"",""question_type"":""MCQ"",""marks"":1,""mcq_options"":[""A. 30°"",""B. 42°"",""C. 60°"",""D. 90°""]}"
"3044","305","44","Which device is used to measure voltage?","MCQ","1","{""question_number"":""44"",""question_text"":""Which device is used to measure voltage?"",""question_type"":""MCQ"",""marks"":1,""mcq_options"":[""A. Ammeter"",""B. Voltmeter"",""C. Ohmmeter"",""D. Galvanometer""]}"
"3045","305","45","What is the formula for centripetal force?","MCQ","1","{""question_number"":""45"",""question_text"":""What is the formula for centripetal force?"",""question_type"":""MCQ"",""marks"":1,""mcq_options"":[""A. F = mv²/r"",""B. F = mvr"",""C. F = mv/r"",""D. F = mr/v""]}"
"3046","305","46","Which phenomenon causes the spreading of light?","MCQ","1","{""question_number"":""46"",""question_text"":""Which phenomenon causes the spreading of light?"",""question_type"":""MCQ"",""marks"":1,""mcq_options"":[""A. Reflection"",""B. Refraction"",""C. Diffraction"",""D. Polarization""]}"
"3047","305","47","What is the SI unit of inductance?","MCQ","1","{""question_number"":""47"",""question_text"":""What is the SI unit of inductance?"",""question_type"":""MCQ"",""marks"":1,""mcq_options"":[""A. Farad"",""B. Henry"",""C. Tesla"",""D. Weber""]}"
"3048","305","48","Which type of radiation has the shortest wavelength?","MCQ","1","{""question_number"":""48"",""question_text"":""Which type of radiation has the shortest wavelength?"",""question_type"":""MCQ"",""marks"":1,""mcq_options"":[""A. Radio waves"",""B. Microwaves"",""C. X-rays"",""D. Gamma rays""]}"
"3049","305","49","What is the escape velocity from Earth?","MCQ","1","{""question_number"":""49"",""question_text"":""What is the escape velocity from Earth?"",""question_type"":""MCQ"",""marks"":1,""mcq_options"":[""A. 7.9 km/s"",""B. 11.2 km/s"",""C. 15.0 km/s"",""D. 25.0 km/s""]}"
"3050","305","50","Which principle is used in hydraulic machines?","MCQ","1","{""question_number"":""50"",""question_text"":""Which principle is used in hydraulic machines?"",""question_type"":""MCQ"",""marks"":1,""mcq_options"":[""A. Archimedes' principle"",""B. Pascal's principle"",""C. Bernoulli's principle"",""D. Hooke's law""]}"
"3051","306","51","Explain the concept of circular motion and centripetal force.","FRQ","4","{""question_number"":""51"",""question_text"":""Explain the concept of circular motion and centripetal force."",""question_type"":""FRQ"",""marks"":4,""mcq_options"":null}"
"3052","306","52","Describe the structure and function of an AC generator.","FRQ","5","{""question_number"":""52"",""question_text"":""Describe the structure and function of an AC generator."",""question_type"":""FRQ"",""marks"":5,""mcq_options"":null}"
"3053","306","53","Explain the concept of latent heat and its significance in phase changes.","FRQ","4","{""question_number"":""53"",""question_text"":""Explain the concept of latent heat and its significance in phase changes."",""question_type"":""FRQ"",""marks"":4,""mcq_options"":null}"
"3054","306","54","Describe the structure and function of a transistor.","FRQ","5","{""question_number"":""54"",""question_text"":""Describe the structure and function of a transistor."",""question_type"":""FRQ"",""marks"":5,""mcq_options"":null}"
"3055","306","55","Explain the concept of nuclear fusion and its potential as an energy source.","FRQ","5","{""question_number"":""55"",""question_text"":""Explain the concept of nuclear fusion and its potential as an energy source."",""question_type"":""FRQ"",""marks"":5,""mcq_options"":null}"
"3056","306","56","Describe the principles of operation of a DC generator.","FRQ","5","{""question_number"":""56"",""question_text"":""Describe the principles of operation of a DC generator."",""question_type"":""FRQ"",""marks"":5,""mcq_options"":null}"
"3057","306","57","Explain the concept of resonance and give examples.","FRQ","4","{""question_number"":""57"",""question_text"":""Explain the concept of resonance and give examples."",""question_type"":""FRQ"",""marks"":4,""mcq_options"":null}"
"3058","306","58","Describe the structure and function of a semiconductor transistor.","FRQ","5","{""question_number"":""58"",""question_text"":""Describe the structure and function of a semiconductor transistor."",""question_type"":""FRQ"",""marks"":5,""mcq_options"":null}"
"3059","306","59","Explain the concept of thermodynamics and the laws of thermodynamics.","FRQ","6","{""question_number"":""59"",""question_text"":""Explain the concept of thermodynamics and the laws of thermodynamics."",""question_type"":""FRQ"",""marks"":6,""mcq_options"":null}"
"3060","306","60","Describe the principles of operation of a nuclear power plant.","FRQ","5","{""question_number"":""60"",""question_text"":""Describe the principles of operation of a nuclear power plant."",""question_type"":""FRQ"",""marks"":5,""mcq_options"":null}"
"3061","307","61","What is the SI unit of electric potential?","MCQ","1","{""question_number"":""61"",""question_text"":""What is the SI unit of electric potential?"",""question_type"":""MCQ"",""marks"":1,""mcq_options"":[""A. Volt"",""B. Ampere"",""C. Coulomb"",""D. Ohm""]}"
"3062","307","62","Which effect explains the deflection of charged particles in magnetic fields?","MCQ","1","{""question_number"":""62"",""question_text"":""Which effect explains the deflection of charged particles in magnetic fields?"",""question_type"":""MCQ"",""marks"":1,""mcq_options"":[""A. Photoelectric effect"",""B. Compton effect"",""C. Lorentz force"",""D. Hall effect""]}"
"3063","307","63","What is the magnification of a plane mirror?","MCQ","1","{""question_number"":""63"",""question_text"":""What is the magnification of a plane mirror?"",""question_type"":""MCQ"",""marks"":1,""mcq_options"":[""A. 0"",""B. 1"",""C. 2"",""D. Infinity""]}"
"3064","307","64","Which device is used to step up or step down voltage?","MCQ","1","{""question_number"":""64"",""question_text"":""Which device is used to step up or step down voltage?"",""question_type"":""MCQ"",""marks"":1,""mcq_options"":[""A. Generator"",""B. Motor"",""C. Transformer"",""D. Capacitor""]}"
"3065","307","65","What is the formula for rotational kinetic energy?","MCQ","1","{""question_number"":""65"",""question_text"":""What is the formula for rotational kinetic energy?"",""question_type"":""MCQ"",""marks"":1,""mcq_options"":[""A. KE = ½Iω²"",""B. KE = Iω"",""C. KE = ½Iω"",""D. KE = Iω²""]}"
"3066","307","66","Which phenomenon explains the blue color of the sky?","MCQ","1","{""question_number"":""66"",""question_text"":""Which phenomenon explains the blue color of the sky?"",""question_type"":""MCQ"",""marks"":1,""mcq_options"":[""A. Reflection"",""B. Refraction"",""C. Scattering"",""D. Absorption""]}"
"3067","307","67","What is the SI unit of resistance?","MCQ","1","{""question_number"":""67"",""question_text"":""What is the SI unit of resistance?"",""question_type"":""MCQ"",""marks"":1,""mcq_options"":[""A. Volt"",""B. Ampere"",""C. Ohm"",""D. Watt""]}"
"3068","307","68","Which type of wave can travel through vacuum?","MCQ","1","{""question_number"":""68"",""question_text"":""Which type of wave can travel through vacuum?"",""question_type"":""MCQ"",""marks"":1,""mcq_options"":[""A. Sound wave"",""B. Water wave"",""C. Electromagnetic wave"",""D. Seismic wave""]}"
"3069","307","69","What is the period of a geostationary satellite?","MCQ","1","{""question_number"":""69"",""question_text"":""What is the period of a geostationary satellite?"",""question_type"":""MCQ"",""marks"":1,""mcq_options"":[""A. 12 hours"",""B. 24 hours"",""C. 48 hours"",""D. 72 hours""]}"
"3070","307","70","Which law relates temperature and volume of gases?","MCQ","1","{""question_number"":""70"",""question_text"":""Which law relates temperature and volume of gases?"",""question_type"":""MCQ"",""marks"":1,""mcq_options"":[""A. Boyle's law"",""B. Charles's law"",""C. Gay-Lussac's law"",""D. Ideal gas law""]}"
"3071","308","71","Explain the concept of projectile motion and the independence of horizontal and vertical motion.","FRQ","4","{""question_number"":""71"",""question_text"":""Explain the concept of projectile motion and the independence of horizontal and vertical motion."",""question_type"":""FRQ"",""marks"":4,""mcq_options"":null}"
"3072","308","72","Describe the structure and function of a capacitor in a circuit.","FRQ","5","{""question_number"":""72"",""question_text"":""Describe the structure and function of a capacitor in a circuit."",""question_type"":""FRQ"",""marks"":5,""mcq_options"":null}"
"3073","308","73","Explain the concept of specific latent heat of fusion and vaporization.","FRQ","4","{""question_number"":""73"",""question_text"":""Explain the concept of specific latent heat of fusion and vaporization."",""question_type"":""FRQ"",""marks"":4,""mcq_options"":null}"
"3074","308","74","Describe the structure and function of a logic gate.","FRQ","5","{""question_number"":""74"",""question_text"":""Describe the structure and function of a logic gate."",""question_type"":""FRQ"",""marks"":5,""mcq_options"":null}"
"3075","308","75","Explain the concept of radioactive decay and the different types of radiation.","FRQ","5","{""question_number"":""75"",""question_text"":""Explain the concept of radioactive decay and the different types of radiation."",""question_type"":""FRQ"",""marks"":5,""mcq_options"":null}"
"3076","308","76","Describe the principles of operation of a transformer.","FRQ","5","{""question_number"":""76"",""question_text"":""Describe the principles of operation of a transformer."",""question_type"":""FRQ"",""marks"":5,""mcq_options"":null}"
"3077","308","77","Explain the concept of wave-particle duality and give examples.","FRQ","4","{""question_number"":""77"",""question_text"":""Explain the concept of wave-particle duality and give examples."",""question_type"":""FRQ"",""marks"":4,""mcq_options"":null}"
"3078","308","78","Describe the structure and function of a semiconductor diode.","FRQ","5","{""question_number"":""78"",""question_text"":""Describe the structure and function of a semiconductor diode."",""question_type"":""FRQ"",""marks"":5,""mcq_options"":null}"
"3079","308","79","Explain the concept of heat engines and their efficiency.","FRQ","5","{""question_number"":""79"",""question_text"":""Explain the concept of heat engines and their efficiency."",""question_type"":""FRQ"",""marks"":5,""mcq_options"":null}"
"3080","308","80","Describe the principles of operation of a cyclotron.","FRQ","5","{""question_number"":""80"",""question_text"":""Describe the principles of operation of a cyclotron."",""question_type"":""FRQ"",""marks"":5,""mcq_options"":null}"
"3081","309","81","What is the SI unit of luminous intensity?","MCQ","1","{""question_number"":""81"",""question_text"":""What is the SI unit of luminous intensity?"",""question_type"":""MCQ"",""marks"":1,""mcq_options"":[""A. Lumen"",""B. Candela"",""C. Lux"",""D. Watt""]}"
"3082","309","82","Which effect is used in photodiodes?","MCQ","1","{""question_number"":""82"",""question_text"":""Which effect is used in photodiodes?"",""question_type"":""MCQ"",""marks"":1,""mcq_options"":[""A. Photoelectric effect"",""B. Photovoltaic effect"",""C. Compton effect"",""D. Thermoelectric effect""]}"
"3083","309","83","What is the minimum deviation for a ray passing through a prism?","MCQ","1","{""question_number"":""83"",""question_text"":""What is the minimum deviation for a ray passing through a prism?"",""question_type"":""MCQ"",""marks"":1,""mcq_options"":[""A. When ray is parallel to base"",""B. When ray passes symmetrically"",""C. When ray grazes the surface"",""D. When ray is perpendicular""]}"
"3084","309","84","Which device converts AC to DC?","MCQ","1","{""question_number"":""84"",""question_text"":""Which device converts AC to DC?"",""question_type"":""MCQ"",""marks"":1,""mcq_options"":[""A. Transformer"",""B. Rectifier"",""C. Inverter"",""D. Amplifier""]}"
"3085","309","85","What is the formula for torque?","MCQ","1","{""question_number"":""85"",""question_text"":""What is the formula for torque?"",""question_type"":""MCQ"",""marks"":1,""mcq_options"":[""A. τ = rF"",""B. τ = r × F"",""C. τ = rF sin θ"",""D. All of the above""]}"
"3086","309","86","Which phenomenon explains the formation of rainbows?","MCQ","1","{""question_number"":""86"",""question_text"":""Which phenomenon explains the formation of rainbows?"",""question_type"":""MCQ"",""marks"":1,""mcq_options"":[""A. Reflection only"",""B. Refraction only"",""C. Dispersion and total internal reflection"",""D. Scattering""]}"
"3087","309","87","What is the SI unit of magnetic permeability?","MCQ","1","{""question_number"":""87"",""question_text"":""What is the SI unit of magnetic permeability?"",""question_type"":""MCQ"",""marks"":1,""mcq_options"":[""A. H/m"",""B. T·m/A"",""C. Both A and B"",""D. Wb/m""]}"
