"id","paperId","questionNumber","questionText","questionType","marks","rawLlMExtractedQuestion"
"3175","318","175","Explain the concept of nuclear cross-section and its significance.","FRQ","5","{""question_number"":""175"",""question_text"":""Explain the concept of nuclear cross-section and its significance."",""question_type"":""FRQ"",""marks"":5,""mcq_options"":null}"
"3176","318","176","Describe the principles of operation of a light-emitting diode (LED).","FRQ","5","{""question_number"":""176"",""question_text"":""Describe the principles of operation of a light-emitting diode (LED)."",""question_type"":""FRQ"",""marks"":5,""mcq_options"":null}"
"3177","318","177","Explain the concept of quantum computing and its potential.","FRQ","5","{""question_number"":""177"",""question_text"":""Explain the concept of quantum computing and its potential."",""question_type"":""FRQ"",""marks"":5,""mcq_options"":null}"
"3178","318","178","Describe the structure and function of an integrated circuit.","FRQ","5","{""question_number"":""178"",""question_text"":""Describe the structure and function of an integrated circuit."",""question_type"":""FRQ"",""marks"":5,""mcq_options"":null}"
"3179","318","179","Explain the concept of heat pumps and their efficiency.","FRQ","5","{""question_number"":""179"",""question_text"":""Explain the concept of heat pumps and their efficiency."",""question_type"":""FRQ"",""marks"":5,""mcq_options"":null}"
"3180","318","180","Describe the principles of operation of a transmission electron microscope (TEM).","FRQ","5","{""question_number"":""180"",""question_text"":""Describe the principles of operation of a transmission electron microscope (TEM)."",""question_type"":""FRQ"",""marks"":5,""mcq_options"":null}"
"3181","319","181","What is the neutron multiplication factor?","MCQ","1","{""question_number"":""181"",""question_text"":""What is the neutron multiplication factor?"",""question_type"":""MCQ"",""marks"":1,""mcq_options"":[""A. Number of fissions per neutron"",""B. Number of neutrons per fission"",""C. Rate of neutron production"",""D. Rate of neutron absorption""]}"
"3182","319","182","Which particle mediates weak nuclear force?","MCQ","1","{""question_number"":""182"",""question_text"":""Which particle mediates weak nuclear force?"",""question_type"":""MCQ"",""marks"":1,""mcq_options"":[""A. Photon"",""B. Gluon"",""C. W and Z bosons"",""D. Graviton""]}"
"3183","319","183","What is modal dispersion in optical fibers?","MCQ","1","{""question_number"":""183"",""question_text"":""What is modal dispersion in optical fibers?"",""question_type"":""MCQ"",""marks"":1,""mcq_options"":[""A. Spreading due to different path lengths"",""B. Spreading due to wavelength"",""C. Spreading due to material properties"",""D. Spreading due to bending""]}"
"3184","319","184","Which configuration gives maximum current gain in transistors?","MCQ","1","{""question_number"":""184"",""question_text"":""Which configuration gives maximum current gain in transistors?"",""question_type"":""MCQ"",""marks"":1,""mcq_options"":[""A. Common emitter"",""B. Common base"",""C. Common collector"",""D. All are equal""]}"
"3185","319","185","What is the amplitude of oscillation in SHM?","MCQ","1","{""question_number"":""185"",""question_text"":""What is the amplitude of oscillation in SHM?"",""question_type"":""MCQ"",""marks"":1,""mcq_options"":[""A. Maximum displacement"",""B. Average displacement"",""C. Minimum displacement"",""D. Total displacement""]}"
"3186","319","186","Which effect limits the resolution of optical instruments?","MCQ","1","{""question_number"":""186"",""question_text"":""Which effect limits the resolution of optical instruments?"",""question_type"":""MCQ"",""marks"":1,""mcq_options"":[""A. Reflection"",""B. Refraction"",""C. Diffraction"",""D. Absorption""]}"
"3187","319","187","What is the uncertainty principle?","MCQ","1","{""question_number"":""187"",""question_text"":""What is the uncertainty principle?"",""question_type"":""MCQ"",""marks"":1,""mcq_options"":[""A. Δx·Δp ≥ ℏ/2"",""B. Δx·Δp ≤ ℏ/2"",""C. Δx·Δp = ℏ/2"",""D. Δx·Δp = ℏ""]}"
"3188","319","188","Which device converts AC to DC with high efficiency?","MCQ","1","{""question_number"":""188"",""question_text"":""Which device converts AC to DC with high efficiency?"",""question_type"":""MCQ"",""marks"":1,""mcq_options"":[""A. Half-wave rectifier"",""B. Full-wave rectifier"",""C. Bridge rectifier"",""D. Voltage doubler""]}"
"3189","319","189","What is dark energy?","MCQ","1","{""question_number"":""189"",""question_text"":""What is dark energy?"",""question_type"":""MCQ"",""marks"":1,""mcq_options"":[""A. Energy of black holes"",""B. Energy causing accelerated expansion"",""C. Nuclear energy"",""D. Gravitational energy""]}"
"3190","319","190","Which temperature corresponds to absolute zero?","MCQ","1","{""question_number"":""190"",""question_text"":""Which temperature corresponds to absolute zero?"",""question_type"":""MCQ"",""marks"":1,""mcq_options"":[""A. 0°C"",""B. -273°C"",""C. -273.15°C"",""D. -300°C""]}"
"3191","320","191","Explain the concept of torque and its role in rotational motion.","FRQ","4","{""question_number"":""191"",""question_text"":""Explain the concept of torque and its role in rotational motion."",""question_type"":""FRQ"",""marks"":4,""mcq_options"":null}"
"3192","320","192","Describe the structure and function of a voltage regulator circuit.","FRQ","5","{""question_number"":""192"",""question_text"":""Describe the structure and function of a voltage regulator circuit."",""question_type"":""FRQ"",""marks"":5,""mcq_options"":null}"
"3193","320","193","Explain the concept of thermal resistance and its applications.","FRQ","4","{""question_number"":""193"",""question_text"":""Explain the concept of thermal resistance and its applications."",""question_type"":""FRQ"",""marks"":4,""mcq_options"":null}"
"3194","320","194","Describe the structure and function of a memory chip.","FRQ","5","{""question_number"":""194"",""question_text"":""Describe the structure and function of a memory chip."",""question_type"":""FRQ"",""marks"":5,""mcq_options"":null}"
"3195","320","195","Explain the concept of nuclear chain reactions and critical mass.","FRQ","5","{""question_number"":""195"",""question_text"":""Explain the concept of nuclear chain reactions and critical mass."",""question_type"":""FRQ"",""marks"":5,""mcq_options"":null}"
"3196","320","196","Describe the principles of operation of a solar cell.","FRQ","5","{""question_number"":""196"",""question_text"":""Describe the principles of operation of a solar cell."",""question_type"":""FRQ"",""marks"":5,""mcq_options"":null}"
"3197","320","197","Explain the concept of quantum field theory and its significance.","FRQ","5","{""question_number"":""197"",""question_text"":""Explain the concept of quantum field theory and its significance."",""question_type"":""FRQ"",""marks"":5,""mcq_options"":null}"
"3198","320","198","Describe the structure and function of a microcontroller.","FRQ","5","{""question_number"":""198"",""question_text"":""Describe the structure and function of a microcontroller."",""question_type"":""FRQ"",""marks"":5,""mcq_options"":null}"
"3199","320","199","Explain the concept of gas turbines and their efficiency.","FRQ","5","{""question_number"":""199"",""question_text"":""Explain the concept of gas turbines and their efficiency."",""question_type"":""FRQ"",""marks"":5,""mcq_options"":null}"
"3200","320","200","Describe the principles of operation of an atomic force microscope (AFM).","FRQ","5","{""question_number"":""200"",""question_text"":""Describe the principles of operation of an atomic force microscope (AFM)."",""question_type"":""FRQ"",""marks"":5,""mcq_options"":null}"
"3201","321","201","Explain the concept of gravitational potential energy and its applications.","FRQ","4","{""question_number"":""201"",""question_text"":""Explain the concept of gravitational potential energy and its applications."",""question_type"":""FRQ"",""marks"":4,""mcq_options"":null}"
"3202","321","202","Describe the structure and function of a phase-locked loop (PLL).","FRQ","5","{""question_number"":""202"",""question_text"":""Describe the structure and function of a phase-locked loop (PLL)."",""question_type"":""FRQ"",""marks"":5,""mcq_options"":null}"
"3203","321","203","Explain the concept of thermal efficiency and its importance.","FRQ","4","{""question_number"":""203"",""question_text"":""Explain the concept of thermal efficiency and its importance."",""question_type"":""FRQ"",""marks"":4,""mcq_options"":null}"
"3204","321","204","Describe the structure and function of a digital signal processor (DSP).","FRQ","5","{""question_number"":""204"",""question_text"":""Describe the structure and function of a digital signal processor (DSP)."",""question_type"":""FRQ"",""marks"":5,""mcq_options"":null}"
"3205","321","205","Explain the concept of nuclear radiation shielding and its principles.","FRQ","5","{""question_number"":""205"",""question_text"":""Explain the concept of nuclear radiation shielding and its principles."",""question_type"":""FRQ"",""marks"":5,""mcq_options"":null}"
"3206","321","206","Describe the principles of operation of a fuel cell.","FRQ","5","{""question_number"":""206"",""question_text"":""Describe the principles of operation of a fuel cell."",""question_type"":""FRQ"",""marks"":5,""mcq_options"":null}"
"3207","321","207","Explain the concept of quantum superposition and its applications.","FRQ","5","{""question_number"":""207"",""question_text"":""Explain the concept of quantum superposition and its applications."",""question_type"":""FRQ"",""marks"":5,""mcq_options"":null}"
"3208","321","208","Describe the structure and function of a programmable logic controller (PLC).","FRQ","5","{""question_number"":""208"",""question_text"":""Describe the structure and function of a programmable logic controller (PLC)."",""question_type"":""FRQ"",""marks"":5,""mcq_options"":null}"
"3209","321","209","Explain the concept of internal combustion engines and their efficiency.","FRQ","5","{""question_number"":""209"",""question_text"":""Explain the concept of internal combustion engines and their efficiency."",""question_type"":""FRQ"",""marks"":5,""mcq_options"":null}"
"3210","321","210","Describe the principles of operation of a scanning tunneling microscope (STM).","FRQ","5","{""question_number"":""210"",""question_text"":""Describe the principles of operation of a scanning tunneling microscope (STM)."",""question_type"":""FRQ"",""marks"":5,""mcq_options"":null}"
"3211","322","211","Explain the concept of fluid dynamics and Bernoulli's equation.","FRQ","4","{""question_number"":""211"",""question_text"":""Explain the concept of fluid dynamics and Bernoulli's equation."",""question_type"":""FRQ"",""marks"":4,""mcq_options"":null}"
"3212","322","212","Describe the structure and function of a frequency modulation (FM) circuit.","FRQ","5","{""question_number"":""212"",""question_text"":""Describe the structure and function of a frequency modulation (FM) circuit."",""question_type"":""FRQ"",""marks"":5,""mcq_options"":null}"
"3213","322","213","Explain the concept of thermal conductivity and its measurement.","FRQ","4","{""question_number"":""213"",""question_text"":""Explain the concept of thermal conductivity and its measurement."",""question_type"":""FRQ"",""marks"":4,""mcq_options"":null}"
"3214","322","214","Describe the structure and function of a field-programmable gate array (FPGA).","FRQ","5","{""question_number"":""214"",""question_text"":""Describe the structure and function of a field-programmable gate array (FPGA)."",""question_type"":""FRQ"",""marks"":5,""mcq_options"":null}"
"3215","322","215","Explain the concept of nuclear waste disposal and its challenges.","FRQ","5","{""question_number"":""215"",""question_text"":""Explain the concept of nuclear waste disposal and its challenges."",""question_type"":""FRQ"",""marks"":5,""mcq_options"":null}"
"3216","322","216","Describe the principles of operation of a wind turbine.","FRQ","5","{""question_number"":""216"",""question_text"":""Describe the principles of operation of a wind turbine."",""question_type"":""FRQ"",""marks"":5,""mcq_options"":null}"
"3217","322","217","Explain the concept of quantum cryptography and its security.","FRQ","5","{""question_number"":""217"",""question_text"":""Explain the concept of quantum cryptography and its security."",""question_type"":""FRQ"",""marks"":5,""mcq_options"":null}"
"3218","322","218","Describe the structure and function of a digital camera sensor.","FRQ","5","{""question_number"":""218"",""question_text"":""Describe the structure and function of a digital camera sensor."",""question_type"":""FRQ"",""marks"":5,""mcq_options"":null}"
"3219","322","219","Explain the concept of steam engines and their efficiency.","FRQ","5","{""question_number"":""219"",""question_text"":""Explain the concept of steam engines and their efficiency."",""question_type"":""FRQ"",""marks"":5,""mcq_options"":null}"
"3220","322","220","Describe the principles of operation of a particle detector.","FRQ","5","{""question_number"":""220"",""question_text"":""Describe the principles of operation of a particle detector."",""question_type"":""FRQ"",""marks"":5,""mcq_options"":null}"
"3221","323","221","Explain the concept of buoyancy and Archimedes' principle.","FRQ","4","{""question_number"":""221"",""question_text"":""Explain the concept of buoyancy and Archimedes' principle."",""question_type"":""FRQ"",""marks"":4,""mcq_options"":null}"
"3222","323","222","Describe the structure and function of an amplitude modulation (AM) circuit.","FRQ","5","{""question_number"":""222"",""question_text"":""Describe the structure and function of an amplitude modulation (AM) circuit."",""question_type"":""FRQ"",""marks"":5,""mcq_options"":null}"
"3223","323","223","Explain the concept of thermal insulation and its applications.","FRQ","4","{""question_number"":""223"",""question_text"":""Explain the concept of thermal insulation and its applications."",""question_type"":""FRQ"",""marks"":4,""mcq_options"":null}"
"3224","323","224","Describe the structure and function of a microphone.","FRQ","5","{""question_number"":""224"",""question_text"":""Describe the structure and function of a microphone."",""question_type"":""FRQ"",""marks"":5,""mcq_options"":null}"
"3225","323","225","Explain the concept of nuclear medicine and its applications.","FRQ","5","{""question_number"":""225"",""question_text"":""Explain the concept of nuclear medicine and its applications."",""question_type"":""FRQ"",""marks"":5,""mcq_options"":null}"
"3226","323","226","Describe the principles of operation of a hydroelectric power plant.","FRQ","5","{""question_number"":""226"",""question_text"":""Describe the principles of operation of a hydroelectric power plant."",""question_type"":""FRQ"",""marks"":5,""mcq_options"":null}"
"3227","323","227","Explain the concept of quantum dots and their applications.","FRQ","5","{""question_number"":""227"",""question_text"":""Explain the concept of quantum dots and their applications."",""question_type"":""FRQ"",""marks"":5,""mcq_options"":null}"
"3228","323","228","Describe the structure and function of a loudspeaker.","FRQ","5","{""question_number"":""228"",""question_text"":""Describe the structure and function of a loudspeaker."",""question_type"":""FRQ"",""marks"":5,""mcq_options"":null}"
"3229","323","229","Explain the concept of diesel engines and their efficiency.","FRQ","5","{""question_number"":""229"",""question_text"":""Explain the concept of diesel engines and their efficiency."",""question_type"":""FRQ"",""marks"":5,""mcq_options"":null}"
"3230","323","230","Describe the principles of operation of a cloud chamber.","FRQ","5","{""question_number"":""230"",""question_text"":""Describe the principles of operation of a cloud chamber."",""question_type"":""FRQ"",""marks"":5,""mcq_options"":null}"
"3231","324","231","Explain the concept of fluid pressure and Pascal's principle.","FRQ","4","{""question_number"":""231"",""question_text"":""Explain the concept of fluid pressure and Pascal's principle."",""question_type"":""FRQ"",""marks"":4,""mcq_options"":null}"
"3232","324","232","Describe the structure and function of a phase modulation (PM) circuit.","FRQ","5","{""question_number"":""232"",""question_text"":""Describe the structure and function of a phase modulation (PM) circuit."",""question_type"":""FRQ"",""marks"":5,""mcq_options"":null}"
"3233","324","233","Explain the concept of thermal radiation and Stefan-Boltzmann law.","FRQ","4","{""question_number"":""233"",""question_text"":""Explain the concept of thermal radiation and Stefan-Boltzmann law."",""question_type"":""FRQ"",""marks"":4,""mcq_options"":null}"
"3234","324","234","Describe the structure and function of a speaker.","FRQ","5","{""question_number"":""234"",""question_text"":""Describe the structure and function of a speaker."",""question_type"":""FRQ"",""marks"":5,""mcq_options"":null}"
"3235","324","235","Explain the concept of nuclear fusion reactors and their challenges.","FRQ","5","{""question_number"":""235"",""question_text"":""Explain the concept of nuclear fusion reactors and their challenges."",""question_type"":""FRQ"",""marks"":5,""mcq_options"":null}"
"3236","324","236","Describe the principles of operation of a geothermal power plant.","FRQ","5","{""question_number"":""236"",""question_text"":""Describe the principles of operation of a geothermal power plant."",""question_type"":""FRQ"",""marks"":5,""mcq_options"":null}"
"3237","324","237","Explain the concept of quantum wells and their applications.","FRQ","5","{""question_number"":""237"",""question_text"":""Explain the concept of quantum wells and their applications."",""question_type"":""FRQ"",""marks"":5,""mcq_options"":null}"
"3238","324","238","Describe the structure and function of a CCD sensor.","FRQ","5","{""question_number"":""238"",""question_text"":""Describe the structure and function of a CCD sensor."",""question_type"":""FRQ"",""marks"":5,""mcq_options"":null}"
"3239","324","239","Explain the concept of Otto cycle and its efficiency.","FRQ","5","{""question_number"":""239"",""question_text"":""Explain the concept of Otto cycle and its efficiency."",""question_type"":""FRQ"",""marks"":5,""mcq_options"":null}"
"3240","324","240","Describe the principles of operation of a bubble chamber.","FRQ","5","{""question_number"":""240"",""question_text"":""Describe the principles of operation of a bubble chamber."",""question_type"":""FRQ"",""marks"":5,""mcq_options"":null}"
"3241","325","241","Explain the concept of viscosity and its effects on fluid flow.","FRQ","4","{""question_number"":""241"",""question_text"":""Explain the concept of viscosity and its effects on fluid flow."",""question_type"":""FRQ"",""marks"":4,""mcq_options"":null}"
"3242","325","242","Describe the structure and function of a pulse width modulation (PWM) circuit.","FRQ","5","{""question_number"":""242"",""question_text"":""Describe the structure and function of a pulse width modulation (PWM) circuit."",""question_type"":""FRQ"",""marks"":5,""mcq_options"":null}"
"3243","325","243","Explain the concept of thermal equilibrium and heat transfer.","FRQ","4","{""question_number"":""243"",""question_text"":""Explain the concept of thermal equilibrium and heat transfer."",""question_type"":""FRQ"",""marks"":4,""mcq_options"":null}"
"3244","325","244","Describe the structure and function of a piezoelectric transducer.","FRQ","5","{""question_number"":""244"",""question_text"":""Describe the structure and function of a piezoelectric transducer."",""question_type"":""FRQ"",""marks"":5,""mcq_options"":null}"
"3245","325","245","Explain the concept of nuclear radiation detection and measurement.","FRQ","5","{""question_number"":""245"",""question_text"":""Explain the concept of nuclear radiation detection and measurement."",""question_type"":""FRQ"",""marks"":5,""mcq_options"":null}"
"3246","325","246","Describe the principles of operation of a tidal power plant.","FRQ","5","{""question_number"":""246"",""question_text"":""Describe the principles of operation of a tidal power plant."",""question_type"":""FRQ"",""marks"":5,""mcq_options"":null}"
"3247","325","247","Explain the concept of quantum tunneling and its applications.","FRQ","5","{""question_number"":""247"",""question_text"":""Explain the concept of quantum tunneling and its applications."",""question_type"":""FRQ"",""marks"":5,""mcq_options"":null}"
"3248","325","248","Describe the structure and function of a CMOS sensor.","FRQ","5","{""question_number"":""248"",""question_text"":""Describe the structure and function of a CMOS sensor."",""question_type"":""FRQ"",""marks"":5,""mcq_options"":null}"
"3249","325","249","Explain the concept of Diesel cycle and its efficiency.","FRQ","5","{""question_number"":""249"",""question_text"":""Explain the concept of Diesel cycle and its efficiency."",""question_type"":""FRQ"",""marks"":5,""mcq_options"":null}"
"3250","325","250","Describe the principles of operation of a spark chamber.","FRQ","5","{""question_number"":""250"",""question_text"":""Describe the principles of operation of a spark chamber."",""question_type"":""FRQ"",""marks"":5,""mcq_options"":null}"
"3251","326","251","Explain the concept of surface tension and its effects.","FRQ","4","{""question_number"":""251"",""question_text"":""Explain the concept of surface tension and its effects."",""question_type"":""FRQ"",""marks"":4,""mcq_options"":null}"
"3252","326","252","Describe the structure and function of a digital modulation circuit.","FRQ","5","{""question_number"":""252"",""question_text"":""Describe the structure and function of a digital modulation circuit."",""question_type"":""FRQ"",""marks"":5,""mcq_options"":null}"
"3253","326","253","Explain the concept of thermal conduction and its applications.","FRQ","4","{""question_number"":""253"",""question_text"":""Explain the concept of thermal conduction and its applications."",""question_type"":""FRQ"",""marks"":4,""mcq_options"":null}"
"3254","326","254","Describe the structure and function of a Hall effect sensor.","FRQ","5","{""question_number"":""254"",""question_text"":""Describe the structure and function of a Hall effect sensor."",""question_type"":""FRQ"",""marks"":5,""mcq_options"":null}"
"3255","326","255","Explain the concept of nuclear reactor safety and control.","FRQ","5","{""question_number"":""255"",""question_text"":""Explain the concept of nuclear reactor safety and control."",""question_type"":""FRQ"",""marks"":5,""mcq_options"":null}"
"3256","326","256","Describe the principles of operation of a wave power plant.","FRQ","5","{""question_number"":""256"",""question_text"":""Describe the principles of operation of a wave power plant."",""question_type"":""FRQ"",""marks"":5,""mcq_options"":null}"
"3257","326","257","Explain the concept of quantum confinement and its effects.","FRQ","5","{""question_number"":""257"",""question_text"":""Explain the concept of quantum confinement and its effects."",""question_type"":""FRQ"",""marks"":5,""mcq_options"":null}"
"3258","326","258","Describe the structure and function of a phototransistor.","FRQ","5","{""question_number"":""258"",""question_text"":""Describe the structure and function of a phototransistor."",""question_type"":""FRQ"",""marks"":5,""mcq_options"":null}"
"3259","326","259","Explain the concept of Brayton cycle and its efficiency.","FRQ","5","{""question_number"":""259"",""question_text"":""Explain the concept of Brayton cycle and its efficiency."",""question_type"":""FRQ"",""marks"":5,""mcq_options"":null}"
"3260","326","260","Describe the principles of operation of a wire chamber.","FRQ","5","{""question_number"":""260"",""question_text"":""Describe the principles of operation of a wire chamber."",""question_type"":""FRQ"",""marks"":5,""mcq_options"":null}"
"3261","327","261","Explain the concept of capillary action and its applications.","FRQ","4","{""question_number"":""261"",""question_text"":""Explain the concept of capillary action and its applications."",""question_type"":""FRQ"",""marks"":4,""mcq_options"":null}"
"3262","327","262","Describe the structure and function of a frequency shift keying (FSK) circuit.","FRQ","5","{""question_number"":""262"",""question_text"":""Describe the structure and function of a frequency shift keying (FSK) circuit."",""question_type"":""FRQ"",""marks"":5,""mcq_options"":null}"
"3263","327","263","Explain the concept of thermal convection and its applications.","FRQ","4","{""question_number"":""263"",""question_text"":""Explain the concept of thermal convection and its applications."",""question_type"":""FRQ"",""marks"":4,""mcq_options"":null}"
"3264","327","264","Describe the structure and function of a strain gauge.","FRQ","5","{""question_number"":""264"",""question_text"":""Describe the structure and function of a strain gauge."",""question_type"":""FRQ"",""marks"":5,""mcq_options"":null}"
"3265","327","265","Explain the concept of nuclear radiation protection and safety measures.","FRQ","5","{""question_number"":""265"",""question_text"":""Explain the concept of nuclear radiation protection and safety measures."",""question_type"":""FRQ"",""marks"":5,""mcq_options"":null}"
"3266","327","266","Describe the principles of operation of a biomass power plant.","FRQ","5","{""question_number"":""266"",""question_text"":""Describe the principles of operation of a biomass power plant."",""question_type"":""FRQ"",""marks"":5,""mcq_options"":null}"
"3267","327","267","Explain the concept of quantum decoherence and its implications.","FRQ","5","{""question_number"":""267"",""question_text"":""Explain the concept of quantum decoherence and its implications."",""question_type"":""FRQ"",""marks"":5,""mcq_options"":null}"
